,thebibliography
0,"\begin{thebibliography}{99}  
\bibitem{sen1} A. Sen, arXiv: hep-th/0203211. 
\bibitem{sen2} A. Sen, arXiv: hep-th/0203265.
\bibitem{sen3} A. Sen, arXiv: hep-th/0204143.
\bibitem{gibbons} G. W. Gibbons, arXiv: hep-th/0204008.
\bibitem{g2}  G.W. Gibbons, arXiv: hep-th/0301117.
\bibitem{kim}Chanju Kim, Hang Bae Kim, Yoonbai Kim and O-Kab Kwon, hep-th/0301142.
\bibitem{shiu} 
 M. Fairbairn and M.H.G. Tytgat, arXiv: hep-th/0204070;

 A. Feinstein, arXiv: hep-th/0204140; D. Choudhury, D.Ghoshal, D. P. Jatkar and S. Panda, arXiv: hep-th/0204204; 
A. Frolov, L. Kofman and A. Starobinsky, arXiv: hep-th/0204187;
 H. S. Kim, arXiv: hep-th/0204191;
 G. Shiu and Ira Wasserman, arXiv: hep-th/0205003; T. Padmanabhan and
T. Roy Choudhury, Phys.Rev. D66 (2002) 081301[ hep-th/0205055];
 K. Hashimoto, arXiv: hep-th/0204203;
 S. Sugimoto, S. Terashima, hep-th/0205085;
 J. A. Minahan, arXiv: hep-th/0205098;
 L. Cornalba, M. S. Costa and C. Kounnas, arXiv: hep-th/0204261;
 H. B. Benaoum, arXiv: hep-th/0205140;
 xin-zhou Li, Jian-gang Hao and Dao-jun Liu, arXiv: hep-th/0204152;
 J. c. Hwang and H. Noh, arXiv: hep-th/0206100;
Y.-S. Piao, R.-G. Cai, X. Zhang, and Y.-Z. Zhang, hep-ph/0207143;
G. Shiu, S.-H. H. Tye, and I. Wasserman, hep-th/0207119;
X.-z. Li, D.-j. Liu, and J.-g. Hao, hep-th/0207146, On the tachyon inflation;
J.M. Cline, H. Firouzjahi, and P. Martineau,JHEP 0211, 041 (2002), hep-th/0207156; James M. Cline, Hassan Firouzjahi,hep-th/0301101;
Bin Wang, Elcio Abdalla, Ru-Keng Su,  hep-th/0208023;  
  S. Mukohyama, hep-th/0208094;
M.C. Bento, O. Bertolami and A.A. Sen, hep-th/0208124;
J.-g. Hao and X.-z. Li, Phys. Rev. D66, 087301 (2002), hep-th/0209041;
Chanju Kim , Hang Bae Kim and Yoonbai Kim, hep-th/021010.
J.S. Bagla, H.K. Jassal, and T. Padmanabhan, astro-ph/0212198;
Yun-Song Piao, Qing-Guo Huang, Xinmin Zhang, Yuan-Zhong Zhang, hep-ph/0212219.

\bibitem{sen4} Ashoke Sen, hep-th/0207105; Partha Mukhopadhyay and Ashoke Sen,  hep-th/0208142;  Ashoke Sen,  hep-th/0209122.
\bibitem{related topics} Akira Ishida, Shozo Uehara, hep-th/0206102 ;T. Mehen and Brian Wecht, hep-th/0206212;
Kazutoshi Ohta, Takashi Yokono,hep-th/0207004; Nicolas Moeller, Barton Zwiebach, hep-th/0207107; T. Okuda and S. Sugimoto,
hep-th/0208196;  Gary Gibbons, Koji Hashimoto, Piljin Yi, hep-th/0209034; Mohammad R. Garousi, hep-th/0003122; Mohammad R. Garousi,hep-th/0209068;
J. Kluson, hep-th/0209255; Sayan Kar, hep-th/0210108; Haewon Lee, W. S. l'Yi, hep-th/0210221; Kenji Hotta,  hep-th/0212063;
Soo-Jong Rey, Shigeki Sugimoto,  hep-th/0301049;  Chanju Kim, Hang Bae Kim, Yoonbai Kim, O-Kab Kwon, hep-th/0301076; 
Akira Ishida and Shozo Uehara, hep-th/0301179.
\bibitem{quvedo} M. Gasperini, G. Veneziano, The Pre-Big Bang Scenario in String Cosmology,  hep-th/0207130; F. Quevedo, Lectures 
on Strings/Brane Cosmology, hep-th/0210292.
\bibitem{matos}  G.A. Diamandis, B.C. Georgalas , N.E. Mavromatos, E. Papantonopoulos,  hep-th/0203241;
 G.A. Diamandis, B.C. Georgalas , N.E. Mavromatos,
 E. Papantonopoulos, I. Pappa,  hep-th/0107124.

\bibitem{moore} A. A. Gerasimov, S. L. Shatashvili, JHEP 0010 034(2000) [hep-th/0009103]; A. Minahan and B. Zwiebach;
JHEP 0103 038 (2001) [hep-th/0009246]; D. Kutasov,
A. Tseytlin, J. Math Phys., 42 2854 (2001).
\bibitem{paddy} T. Padmanabhan, Phys.Rev. D66 (2002) 021301[hep-th/0204150].
\bibitem{sami2} M. Sami, hep-th/0205146.
\bibitem{klinde} L. Kofman and A. Linde, Phys.Lett. B545 (2002) 8-16[hep-th/0205121].
\bibitem{sami1} M. Sami, P. Chingangbam and T. Qureshi,Phys.Rev. D66 (2002) 043530[hep-th/0205179].
\bibitem{ford} L.H. Ford, Phys. Rev. D, {\bf 35}, 2955 (1987), B. Spokoiny, Phys. Lett. {\bf B
315}, 40 (1993).



\bibitem{papa} E. Papantonopoulos and Papa, Mod. Phys. Lett. {\bf A15}, 2145 (2000) [hep-th/0001183] ; Phys. Rev. {\bf D63}
            , 103506 (2000) [hep-th/0010014] ;
            S. H. S. Alexander, Phys. Rev. {\bf D65},023507 [ hep-th/0105032];
            A. Mazumdar, S. Panda, A. Perez-Lorenzana, Nucl. Phys. {\bf B614}, 101, (2001)[hep-th-0107058];
            Shinji Mukohyama, arXiv: hep-th/0204084.
\bibitem{staro} Gary Felder, Lev Kofman and Alexei Starobinsky ,JHEP 0209 (2002) 026[hep-th/0208019].




\"
