,ref
0,"\refs{\GopakumarKI\VafaWI-\CIV} and more recently by its
surprising relation \refs{ \DijkgraafFC\DijkgraafVW-\DijkgraafDH}
to a bosonic matrix model -- a zero-dimensional model with an
$\hat N\times \hat N$ matrix $M$ and potential $\Tr W(M)$, where
$\hat N\to\infty$.  In this paper, we will investigate some
additional fascinating properties of this example.

Let us first explain the original question that motivated our
investigation. In this model, if the function $W'(x)$ has critical
points $a_i$, $i=1,\dots, k$, then a classical vacuum is chosen by
taking $\Phi$ to be a diagonal matrix whose eigenvalues are the
$a_i$, taken with multiplicity $N_i$; the $N_i$ are any
non-negative integers such that $\sum_iN_i=N$. We let $n$ be the
number of choices of $i$ with $N_i>0$. Clearly, $n\le k$. At the
classical level, the choice of $\Phi$ spontaneously breaks the
gauge group from $U(N)$ to $\prod_iU(N_i)$ (where we include in
the product only the positive $N_i$).  Locally, this group is
isomorphic to $U(1)^n\times\prod_iSU(N_i)$.  At low energies, the
$SU(N_i)$ gauge theories become confining and massive, so quantum
mechanically, the gauge group that is actually observed at low
energies is $U(1)^n$.

Since this is independent of $N_i$, the question now arises of
whether it is possible quantum mechanically to distinguish in a
precise way between vacua that have the same value of $n$ but
different $N_i$.  To make this question clear, start with a choice
of $W(\Phi)$ such that the $a_i$ are far apart and the classical
description of the $\Phi$ field is a good approximation, and put
the theory in a vacuum characterized by a given choice of
integers $N_i$. Now vary the parameters in $W(\Phi)$, possibly
passing through a region in which $a_i$ are not far apart, but
then return to a semiclassical region in which the $a_i$ are
widely separated.  In such a process, can one interpolate from a
vacuum with one set of integers $N_i$ to a vacuum with another set
of integers $\tilde N_i$?

Let us provide a more systematic framework for this question. For
each choice of $W(\Phi)$, the theory under investigation has only
a finite set of vacua.  We will allow the parameters in $W$ to
vary, keeping only the leading coefficient (and the microscopic
gauge coupling parameter of the underlying $U(N)$ theory) fixed.
The varying parameters describe a complex manifold ${\cal T}\cong
{\bf C}^k$.\foot{In this counting, we discard an irrelevant
additive constant in $W(\Phi)$ and set the highest power in $W(x)$
to ${g_k \over k+1 } x^{k+1}= {1 \over k+1 } x^{k+1}$.} As we vary
the parameters in ${\cal T}$, the vacua fit into a moduli space
${\cal M}$ which because of supersymmetry is a complex manifold.
${\cal M}$ is a union of components (irreducible complex
submanifolds) ${\cal M}_\alpha$ which may possibly intersect at
singularities. Each component ${\cal M}_\alpha$ is a finite cover
of ${\cal T}$, and hence by going to infinity in ${\cal T}$, we
reach in each ${\cal M}_\alpha$ at least one semiclassical ``end''
with a definite set of $N_i$.  Our question is now whether the
same ${\cal M}_\alpha$ can have different ends with different sets
of $N_i$.

To avoid undue suspense, let us assert that the answer to this
question has turned out to be ``yes.''  In considering the
question, however, it soon becomes clear that  one really should
ask all the questions that are usually asked in string theory and
$M$-theory. What are the components of ${\cal M}$ and what
distinguishes them? What semi-classical ends do they have and to
what extent do they intersect at singularities? What is the
physics at these singularities?  (Some examples of singularities
have been studied in \FerrariKQ.)  When ${\cal M}$ does have
distinct components ${\cal M}_\alpha$, what kind of natural
``off-shell'' interpolations can one make between them? Without
going back to the underlying $U(N)$ gauge theory (which really
gives the most incisive definition of the whole problem), what
kind of a low energy phenomenological Lagrangian or a ``string
field theory'' can one find that describes all of the ${\cal
M}_\alpha$ at once?

Smooth interpolations between classical limits with different
gauge groups have been found in some other four-dimensional
models.  For example, in \AtiyahQF, in the context of $M$-theory
compactification on a $G_2$ manifold, an interpolation from
$SO(8+2n)$ to $Sp(n)$ was argued, along with several other
examples. This was generalized by Freedman \FriedmannCT, who
considered some additional examples, including models with $SU(N)$
gauge symmetry broken by Wilson lines to $\prod_{i=1}^nSU(N_i)\times U(1)^{n-1}$, and proposed interpolation between different
sets of $N_i$ in that case. Because the symmetry breaking pattern is the
same, one may wonder if the model is actually equivalent by some
string duality to the one considered in the present paper. One obstacle
to finding such a duality is that it is not
clear what the superpotential $W(\Phi)$ would correspond to in the
model considered in \FriedmannCT. At any rate, the present paper
is devoted to studying a field theory problem by field theory
methods; our interpolations and dualities are purely field
theoretic and do not depend on stringy phenomena.

It will become clear that the subject we are exploring is very
rich, and in the
present paper we will really only describe some general properties
and explore some examples.  Most likely, many interesting
phenomena remain to be uncovered.

Since it turns out that ${\cal M}$ does have many components, one
basic question is how to distinguish them. One fundamental
invariant that we have already identified is the rank $n$ of the
true low energy gauge group. In many physical theories, another
important invariant comes from the realization of symmetries:
which subgroup of the global symmetry group is unbroken in a given
component of the moduli space of vacua?  In the present paper,
this criterion will be somewhat less useful, because for generic
$W$ there generally are no global symmetries; still, the
realization of global symmetries, and more generally,
transformations of $\Phi$ that must also be taken to act on the
parameters in ${\cal T}$, will give some important information.
Additional important information will come from a more subtle but
still standard type of order parameter that is provided by
confinement: for an external Wilson loop in a given representation
of $U(N)$, does one observe a Coulomb law or an area law?

All these standard order parameters will play a major role in the
present paper, but we will see that they do not suffice.  We also
will encounter a more subtle sort of order parameter that only can
be defined using supersymmetry.  It may be characterized as
follows.  Suppose that a theory with ${\cal N}=1$ supersymmetry
has $r$ independent chiral superfields ${\cal O}_s$,
$s=1,\dots,r$.\foot{When we say that they are independent, we mean
that they obey no relations in the chiral ring of the theory that are
independent of the parameters $g_k$ in the superpotential.  Since we
are working over the parameter space ${\cal T}$, we are treating the
$g_k$ as variables rather than as fixed complex numbers.}  By
supersymmetry, the ${\cal O}_s$ (or more precisely their
expectation values)  are holomorphic functions on ${\cal M}$.  Now
suppose that $r$ exceeds the complex dimension of the moduli space
${\cal M}$.  Then as functions on any given component ${\cal
M}_\alpha$, the ${\cal O}_s$ inevitably obey some algebraic
equations; if these equations are different for different ${\cal
M}_\alpha$, this gives an order parameter of sorts by which the
${\cal M}_\alpha$ can be distinguished.  We will find many
examples of this situation, where the ${\cal M}_\alpha$ cannot be
distinguished by any conventional order parameter that we can see
but can be distinguished by the chiral equations that are obeyed
on them. When this occurs, we do not know if the
$\alpha$-dependence of these chiral  equations should be regarded
as an explanation for the existence of different branches, or
merely as a description of the phenomenon.

\bigskip\noindent{\it Organization Of The Paper}

This paper is organized as follows.   Section 2 is devoted to
general considerations. In section 2.1, we describe what can be
predicted about the moduli space of vacua from a ``weak coupling''
(actually weak gauge coupling) point of view in which the effects
of the superpotential $W(\Phi)$ are assumed to set in at much
higher energies than the effects of the gauge coupling.  We focus
on understanding what can be said about the moduli space of vacua
using the expected confinement of the low energy gauge theory.

In section 2.2, following previous literature
\refs{\CIV,\CachazoPR}, we consider a strong (gauge) coupling
point of view, in which the superpotential is considered as a
small perturbation of a strongly coupled gauge theory with $W=0$;
this theory has ${\cal N}=2$ supersymmetry and a vacuum structure
determined in \refs{\SeibergRS\ArgyresXH-\KlemmQS}. In previous
work, the strong coupling point of view was used to analyze the
vacua with a given rank $n$ of the unbroken symmetry group. That
analysis assumed that the $N_i$ defined above are all nonzero and
that the degree of $W$ is not too large.  We generalize the
analysis to remove these restrictions.  (This analysis is
completed in Appendix A.)


In section 2.3, we review a construction originally described in
\CIV\ whereby, given vacua for the $U(N)$ gauge theory with any
given set of $N_i$, and any integer $t>1$, one can construct vacua
for the $U(tN)$ gauge theory with $N_i'=tN_i$.  Comparing to our
analysis of confinement in section 2.1, we will see that the vacua
arising this way are precisely the confining vacua in which the
confinement index (defined in section 2.1) is $t$.  Conversely,
all vacua with confinement index $t$ arise by this construction.
Since the theory with $N_i'=tN_i$ also has vacua without
confinement or with lower confinement index (as will be clear in
section 2.1), there must be additional vacua with $N_i'=tN_i$;
they will be studied (in examples) in section 3.

In section 2.4, we present some ways in which different branches
$\CM_\alpha$ can arise and some constraints on the possible
classical limits of a given branch.   We also describe the
simplest mechanism by which different branches may intersect.

In section 3, we will explore the question of interpolating from
one set of $N_i$ to another.  For this, we want to consider the
simplest case in which $n$  is as small as possible. For $n=1$,
the gauge group is completely unbroken at the classical level, so
the question of interpolating between classical limits with
different unbroken gauge groups does not arise.  So the first case
is really that the rank of the low energy gauge group is $n=2$
which (in the minimal case with all $N_i$ non-vanishing) arises
for a cubic superpotential, $k=2$. Since we do not know how to
make the analysis for general $N$, we will explore in detail the
cases of $N=2,3,4,5$, and 6. For these values of $N$ and $k=n=2$,
we determine in detail all branches of the moduli space of vacua,
recovering the confining vacua that were found in section 2.3 and
describing the vacua without confinement.  For the vacua without
confinement, we do get the promised smooth continuations between
different values of $N_i$, including interpolation from
$(N_1,N_2)=(1,3)$ to $(2,2)$ for $N=4$,  from $(1,4) $ to $(2,3)$
for $N=5$, and from $(1,5)$ to $(2,4)$ to $(3,3)$ for $N=6$. We
conjecture that for any $N$, smooth interpolations are possible on
the Coulomb branch from any $(N_1,N_2)$ to any other
$(\tilde N_1,\tilde N_2)$.


In this detailed description for $2\leq N\leq 6$, we also see how
branches with $n=2$ meet branches with $n=1$ at singularities. In
addition to these intersections at finite points on the moduli
space, we find for $2\leq N\leq 6$ that all branches meet the
Coulomb branch at infinity, where the semiclassical description is
valid.

In section 4, we consider the opposite limit of large $n$.  For
$n=N$, that is all $N_i=1$, there is a unique vacuum for each
function $W(\Phi)$ and so our question about the different
branches does not arise.  So we consider the case that $N-n$ is
small but positive.  Here, the simple strong coupling analysis of
section 2.2 predicts that there must be at least $N-n+1$ branches
of vacua.  As far as we know, they are not distinguished by
conventional order parameters.  We show, as suggested above, that
they can be distinguished by determining which holomorphic
functions of the chiral superfields vanish on each branch.  We do
not know how best to interpret this result.

In two appendices, we give more details of the strong gauge
coupling analysis.  In appendix A, we extend the proof that
relates the matrix model curve to the $\CN=2$ curve to $W$ of
high degree. In appendix B, we show how the generalized Konishi
anomaly \refs{\konishione,\konishitwo} which was derived and used
in \CDSW\ arises in the strong gauge coupling regime where the
elementary gauge fields are not visible.  In appendix C we list
some useful properties of Chebyshev polynomials.  Appendix D
defines a magnetic index $\nu$ which characterizes the confinement
in a theory with massless photons.  It is related to the
confinement index $t$ of section 2.3 through $N=t\nu$.

\newsec{General Considerations}

\subsec{Confinement}


Here, we will see what we can say about the $U(N)$ gauge theory
with adjoint superfield $\Phi$ by using confinement as an order
parameter.  First we consider the matter directly in field
theory, and then we re-examine the issues using the matrix model.


We consider a classical vacuum in which $N_i$ eigenvalues of
$\Phi$ are placed at the $i^{th}$ critical point of the
superpotential $W$.  To keep the exposition simple, we will
assume that the $N_i$ are all positive. We also assume that the
critical points of $W$ are distinct, so that all components of
$\Phi$ are massive classically.
 Supposing that the underlying $U(N)$ gauge theory is weakly
coupled at the scale set by those masses, the low energy physics
is simply that of the pure supersymmetric gauge theory with
classical gauge group $G^{cl}_{low}=U(1)^n\times \prod_{i=1}^n
SU(N_i)$.

If $N_i>1$, each of the $SU(N_i)$ theories becomes confining at
exponentially smaller energies. For any $N_i\geq 1$, the $SU(N_i)$
theory has $N_i$ vacua, each with a mass gap. The total number of
vacua for fixed $W$ and fixed $N_i$ is hence $\prod_{i=1}^n N_i$.
If only $W$ and $G^{cl}_{low}$ are specified, and not the
individual number $N_i$ of eigenvalues at the $i^{th}$ critical
point, then the total number of vacua is larger, as one must allow
for permutations of eigenvalues among the critical points.

In the limit of small gauge coupling, the different $SU(N_i)$
factors decouple and each of them confines.  This confinement can
be diagnosed by the possible area law of the Wilson loops $W_i$ of
the various $SU(N_i)$.
 In the full theory, these $W_i$ are not well-defined.
Correspondingly, the full $SU(N)$ theory is not necessarily
confining even if the sub-theories are.
 (In this discussion, the
$U(1)$ factor in the underlying gauge group $U(N)=U(1)\times
SU(N)$ is unimportant, as it decouples and does not contribute to
the dynamics.)  For a precise criterion for confinement, we have
to use Wilson lines of the full $SU(N)$ theory.


To probe confinement, we consider a large Wilson loop in some
representation ${\cal R}$ of $SU(N)$, and ask if it exhibits an
area law or a Coulomb law. All that matters about ${\cal R}$ is
how it transforms under the center of $SU(N)$, which is $\Z_N$,
generated by $\omega={\rm diag}(e^{2\pi i/N},e^{2\pi i/N},
\dots,e^{2\pi i/N})$.  The reason that only the center matters is
that if ${\cal R}$ and ${\cal R}'$ are two irreducible
representations that transform in the same way under the center,
then an external charge in the representation ${\cal R}$ can
combine with gluons to make an external charge in the
representation $\R'$, so one of these external charges is confined
(has infinite energy) if and only if the other is. Turning one
representation into another by combining with gluons is a process
that we may call electric screening.

To give an example with any desired action of the center, we can
simply take ${\cal R}$ to be the tensor product of $r$ copies of
the fundamental representation, for some $r\geq 0$. If $W$ is a
Wilson loop in the fundamental representation, the Wilson loop
for the representation $\R$ is just $W^r$.  Only the value of $r$
modulo $N$ matters.

If two representations ${\cal R}$ and ${\cal R}'$ are unconfined,
then so is the tensor product $\R\otimes \R'$.  So the set of
values of $r$ for which there is no confinement is closed under
addition. There is no area law for $r=N$ (since $r=N$ is
equivalent to $r=0$), so the smallest positive value of $r$ for
which there is no area law is always a divisor of $N$.  We denote
this number as $t$ and call it the confinement index. If the
theory is completely confining (all Wilson loops with non-trivial
action of the center have an area law), then $t=N$, and if the
theory is completely unconfining (no Wilson loop shows an area
law), then $t=1$.

Let us now give a few examples of the behavior of the $SU(N)$
theory.  Suppose that $SU(N)$ is broken classically to
$SU(N-1)\times U(1)$.  All vacua will be unconfining simply
because there is no confinement in $U(1)$.  The fundamental
representation of $SU(N)$ has a component which is an $SU(N-1)$
singlet, and this component feels no confining gauge forces.  When
we evaluate the expectation value of a Wilson line in the
fundamental representation ${\cal R}$,
  \eqn\evrep{\left\langle\Tr_{\cal R}P\exp\oint_CA\right\rangle,}
the gauge field is effectively an $(N-1)\times (N-1)$ matrix and a
commuting $1\times 1$ component associated with the $U(1)$ factor
(plus massive fields that will not influence the question of
confinement). In computing the expectation value in \evrep,
assuming that $C$ is very large compared to the scale at which
$SU(N-1)$ becomes strongly coupled, the dominant contribution will
come from the ``bottom'' component of $\R$. This component does
not interact with the $SU(N-1)$ gauge fields, so there is no area
law.  Since this component interacts with the massless $U(1)$
gauge field, the Wilson loop \evrep\ exhibits the behavior of a
Coulomb phase rather than a Higgs phase.

\bigskip\noindent{\it Computation Of Confinement Index In An
Example}

For a simple example with a non-trivial confinement index, we will
explore the case
 that $SU(N)$ is broken to $SU(N_1)\times
SU(N_2)\times U(1)$. The fundamental representation of $SU(N)$
decomposes as $({\bf N_1},{\bf 1})\oplus ({\bf 1},{\bf N_2})$
under $SU(N_1)\times SU(N_2)$.  (We ignore the $U(1)$ charges,
which will not affect confinement.)  The tensor product of $N_1$
copies of $({\bf N_1},{\bf 1})$ contains a singlet. So, as in the
above example, the Wilson line $W^{N_1}$ will show no area law.
Likewise, $W^{N_2}$ will show no area law.

Let $t'$ be the greatest common divisor of $N_1$ and $N_2$.
Absence of confinement for $r=N_1$ and for $r=N_2$ implies that
there is no confinement for $r=l_1N_1+l_2N_2$ for any positive
integers $l_1,l_2$.  We can pick $l_1$ and $l_2$ so that
$l_1N_1+l_2N_2$ is congruent mod $N$ to $t'$. So the confinement
index $t$ can be no bigger than $t'$, and if electric screening,
which we have considered so far, were the only mechanism, it would
equal $t'$ precisely.

However, there is another mechanism, magnetic screening. Let us
first recall 't Hooft's description of confined phases of $SU(N)$
gauge theory.   One introduces an 't Hooft loop, which we will
call $H$; $H$ is constructed using a twist by an element of the
center of $SU(N)$.  The general loop order parameter is $W^rH^s$,
where $r,s$ both take values from $0$ to $N-1$ (alternatively,
their values only matter modulo $N$). Massive phases are described
by saying for which values of $r,s$ there is no area law; one says
that charges with this value of $r$ and $s$ are ``condensed.'' (In
some situations, for example a confining theory obtained by a
small perturbation of an ${\cal N}=2$ theory, one can make the
intuition behind this language precise \SeibergRS.)  In
particular, there are $N$ possible confining phases; in the
$r^{th}$ such phase, $W^rH$ has no area law, or equivalently a
charge with quantum numbers $W^rH$ is ``condensed.''

${\cal N}=1$ super Yang-Mills theory with gauge group $SU(N)$ has
$N$ confining vacua, with each type appearing precisely once. In
fact, an adiabatic increase of the theta angle by $2\pi$ has the
effect of increasing $r$ by 1.

So when we break the underlying $SU(N)$ theory to $SU(N_1)\times
SU(N_2)\times U(1)$, we get a low energy theory that indeed has
$N_1N_2$ vacua, but they are not equivalent.  They can be
distinguished by the type of confinement.  For each pair $r_1,r_2$
(with $0\leq r_i\leq N_i-1$), there is one vacuum in which
$W_1^{r_1}H_1$ and $W_2^{r_2}H_2$ are unconfined. (Here we write
$W_1$ and $W_2$ for Wilson lines in the fundamental
representations of $SU(N_1)$ and $SU(N_2)$, respectively, and
similarly $H_1$ and $H_2$ are the 't Hooft loops of the two
factors of the low energy gauge group.  As we remarked above,
this makes sense only near the weak gauge coupling limit.)

This theory also has 't Hooft-Polyakov magnetic monopoles.  If
$N=2$, $N_1=N_2=1$, we take the basic $SU(2)$ monopole whose
magnetic field at infinity is (in a unitary gauge) a multiple of
\eqn\harmo{\left(\matrix{1 & 0 \cr 0 & -1 \cr}\right).} For any
$N_1,$ $N_2$, and $N$, we just embed the $SU(2)$ monopole in
$SU(N)$ in such a way that it does not fit entirely in either
$SU(N_1)$ or $SU(N_2)$ -- we take the ``1'' in the upper left to
act in $SU(N_1)$ and the ``$-1$'' in the lower right to act in
$SU(N_2)$.  (We could also embed the monopole entirely in
$SU(N_1)$ or entirely in $SU(N_2)$, but this would give nothing
interesting for our present purposes.)

Now suppose we probe the $(r_1,r_2)$ vacuum of the full $SU(N)$
theory with  the external Wilson loop $W^{r_1-r_2}$. Although
$r_1-r_2$ is not necessarily a multiple of $t'$, we claim that
this Wilson loop will not show an area law. The external $SU(N)$
charge $r_1-r_2$ can, after symmetry breaking to $SU(N_1)\times
SU(N_2)$, be divided between the two factors in various ways, and
confinement will be avoided if there is any way to divide the
charge to make the energy finite.  We simply put $r_1$ units of
charge in $SU(N_1)$ and $-r_2$ units in $SU(N_2)$. (The charges
are only well-defined modulo $N_1$ and $N_2$.)  So in other words,
$W^{r_1-r_2}$ can behave in the low energy theory as $\tilde W=
W_1^{r_1} W_2^{-r_2}$. But the external Wilson line $\tilde W$ can
be screened by the spontaneous nucleation from the vacuum of the
magnetic monopole described in the last paragraph. Since the
monopole has magnetic charge $1$ in $SU(N_1)$ and $-1$ in
$SU(N_2)$, it can be represented as $H_1H_2^{-1}$.  So in
conjunction with a monopole, $\tilde W$ can be represented in the
low energy theory as $W_1^{r_1}H_1 W_2^{-r_2}H_2^{-1}$, and has no
area law since (by the definition of $r_1$ and $r_2$),
$W_1^{r_1}H_1$ has no area law in $SU(N_1)$, and
$W_2^{-r_2}H_2^{-1}$ (which is obtained from $W_2^{r_2}H_2$ by
reversing the orientation of the loop) has no area law in
$SU(N_2)$.

The net effect is that there is no area law for $W^{N_1}$, for
$W^{N_2}$, or for $W^{r_1-r_2}$.  Hence the confinement index $t$
is at most the greatest common divisor of $N_1$, $N_2$, and $b =
r_1-r_2$.  We claim that this is the correct value, since by now
we have considered screening by all of the electric and magnetic
objects that exist in the theory.

It is easy to see why the confinement index depends not on $r_1$
and $r_2$ separately but only on their difference $b$.  In fact,
under $\theta\to\theta+2\pi$, one has $r_i\to r_i+1$, for $i=1,2$,
while external Wilson loops are unaffected.  The confinement index
must be invariant under this operation, so can only depend on the
difference of the $r_i$.

\bigskip\noindent{\it General Case}

We can easily extend this analysis to the general case that $U(N)$
is broken down to $\prod_{i=1}^nU(N_i)$.  Electric screening
ensures that there is no area law for $W^{N_i}$, $i=1,\dots,n$. In
addition, we must consider magnetic screening. The low energy
theory  has $\prod_{i=1}^nN_i$ vacua, which are characterized by
giving integers $r_i$, $i=1,\dots ,n$ (with $0\leq r_i\leq N_i-1$)
such that in the low energy $SU(N_i)$ theory, $W_i^{r_i}H_i$ has
no area law. A magnetic monopole can be shared between $SU(N_i)$
and $SU(N_{i+1})$ in such a way that it has charges
$H_iH_{i+1}^{-1}$.\foot{One can more generally share a monopole
between $SU(N_i)$ and $SU(N_j)$ for any $i,j$, but this monopole
leads to nothing new because its charges are a linear combination
of the charges of monopoles considered in the text.} It follows,
just as in the case with $n=2$ that was considered above, that the
external Wilson line $W^{r_i-r_{i+1}}$ has no area law. (To make
the argument, we simply place $r_i$ units of charge in $SU(N_i)$
and $-r_{i+1}$ units in $SU(N_{i+1})$ and then screen this
configuration using the monopole.)

So if we let $b_i=r_i-r_{i+1}$, the confinement index $t$ is now
the greatest common divisor of the $N_i$ and the $b_i$.

There are $t$ different types of branch with confinement index
$t$. For a branch of the $u^{th}$ type, the operators that do not
have an area law are $W^t$ and $W^uH$.

\bigskip\noindent{\it Interpretation In The Matrix Model}

The matrix model is described \CIV\ by a complex curve $\Sigma$:
 \eqn\guffy{y_m^2= W'(x)^2+f_{n-1}(x),}
where $f$ depends on the gauge coupling and the $N_i$. We assume
for simplicity that $k=n$; i.e.\ no $N_i$ vanishes. $\Sigma$ is a
