,document
0,"\begin{document}
\baselineskip 0.6cm

\begin{titlepage}

\begin{flushright}
UCB-PTH-03/04 \\
LBNL-52212 \\
FERMILAB-Pub-03/033-T
\end{flushright}

\vskip 1.0cm

\begin{center}
{\Large \bf Explicit Supersymmetry Breaking\\
 on Boundaries of Warped Extra Dimensions}

\vskip 1.0cm

{\large
Lawrence J.~Hall$^*$, 
Yasunori Nomura$^\dagger$, 
Takemichi Okui$^*$, 
and Steven J.~Oliver$^*$}

\vskip 0.5cm

$^*$ {\it Department of Physics, University of California, Berkeley,\\
  and\\
    Theoretical Physics Group, Lawrence Berkeley National Laboratory,\\
    Berkeley, CA 94720, USA}\\
$^\dagger$ {\it Theoretical Physics Department, 
    Fermi National Accelerator Laboratory,\\
    Batavia, IL 60510, USA}

\vskip 1.0cm

\abstract{Explicit supersymmetry breaking is studied in higher 
dimensional theories by having boundaries respect only a subgroup 
of the bulk symmetry. If the boundary symmetry is the maximal 
subgroup allowed by the boundary conditions imposed on the fields, 
then the symmetry can be consistently gauged; otherwise gauging 
leads to an inconsistent theory. In a warped fifth dimension, 
an explicit breaking of all bulk supersymmetries by the boundaries 
is found to be inconsistent with gauging; unlike the case of flat 5D, 
complete supersymmetry breaking by boundary conditions is not consistent 
with supergravity. Despite this result, the low energy effective theory
resulting from boundary supersymmetry breaking becomes consistent 
in the limit where gravity decouples, and such models are explored 
in the hope that some way of successfully incorporating gravity 
can be found. A warped constrained standard model leads to a theory 
with one Higgs boson with mass expected close to the experimental 
limit. A unified theory in a warped fifth dimension is studied with 
boundary breaking of both $SU(5)$ gauge symmetry and supersymmetry. 
The usual supersymmetric prediction for gauge coupling unification 
holds even though the TeV spectrum is quite unlike the MSSM. 
Such a theory may unify matter and Higgs in the same $SU(5)$ 
hypermultiplet.}

\end{center}
\end{titlepage}


\section{Introduction}
\label{sec:intro}

A light Higgs boson, suggested by precision electroweak data, together
with a heavy top quark, has direct and consequential implications. 
Virtual top quarks necessarily induce a large quadratic divergence to
the Higgs mass parameter, hence a light Higgs boson is expected only
if this is canceled by additional radiative contributions from new 
physics at energy scales not far above the top quark mass. The most
obvious origin for this cancellation is weak scale supersymmetry, and
the case for this is greatly strengthened by the successful prediction 
from gauge coupling unification.  The experimental implications for 
such theories have focused almost exclusively on theories which are 
four dimensional at the TeV scale --- especially the minimal 
supersymmetric standard model (MSSM). However, higher dimensional 
supersymmetric theories can also tame the divergences of scalar 
mass parameters, with cancellations from Kaluza-Klein (KK) 
modes playing as important a role as cancellations from 
superpartners~\cite{Antoniadis:1998sd}.  Furthermore, beneath the 
mass scale of the lightest KK modes, the 4D effective theory need 
not be supersymmetric --- there is no MSSM limit of the theory.

In the MSSM the weak scale is understood as a byproduct of the more
fundamental supersymmetry breaking scale. When KK modes play a crucial
role in canceling the Higgs mass divergence, the more fundamental scale 
is the effective compactification scale, $M_c$, which is the mass threshold 
for the KK modes. This mass scale, which should not be far above the 
top quark mass, should trigger the breaking of both supersymmetry 
and electroweak symmetry. In the constrained standard model of 
Ref.~\cite{Barbieri:2000vh} $M_c \simeq 350~{\rm GeV}$, and it is obvious 
that there is no MSSM limit: there is only one Higgs doublet, and it 
couples to both up and down type quarks. Two Higgs theories can also be 
constructed~\cite{Arkani-Hamed:2001mi}, as can theories with $M_c$ 
considerably higher, in the $30~{\rm TeV}$ region~\cite{Pomarol:1998sd}. 
These latter theories may mimic the MSSM at future collider experiments.

A common feature of these theories is that supersymmetry breaking
arises because the boundary conditions in the fifth dimension are
taken to differ for fermions and bosons. The non-locality of this 
breaking implies supersymmetry breaking counterterms cannot be
induced by radiative corrections. The cancellations in the Higgs mass 
parameters are more precise than in 4D theories, so that the Higgs 
mass parameters are finite and calculable. In the constrained 
standard model there is only a single Higgs field, with the potential 
calculated in terms of a single free parameter $M_c$, making it 
possible to determine $M_c$ by the $Z$ mass and predict the physical 
Higgs boson mass: $127 \pm 8~{\rm GeV}$. 

Despite these successes, one must admit a significant drawback. 
In all these theories the gauge and Yukawa couplings become strongly 
coupled in the multi-TeV domain and the UV cutoff of the effective 
5D field theory is reached long before the unification scale, so that 
the successful prediction from conventional logarithmic unification 
is lost. Furthermore, since the cutoff of the theory is in the 
multi-TeV domain, one must address the question of why gravity is
so weak. This apparently requires further extra dimensions, either 
in the sub mm domain~\cite{Arkani-Hamed:1998rs} or with a warp 
factor~\cite{Randall:1999ee}.

There is a very simple way to maintain gauge coupling unification 
even when supersymmetry is broken by boundary conditions in a fifth
dimension. It is possible that the difference in the boundary
conditions between fermions and bosons is described by a very small
angle $\alpha$~\cite{Barbieri:2001yz}, so that the scale of the 
superpartners, $\alpha M_c$, can become decoupled from the 
compactification scale. Gauge coupling unification is recovered if 
$M_c$ is taken at or above the unification scale. However, in this 
case, since the KK modes are at or above the unification scale, the 
cancellation of the top divergence in the Higgs mass parameter reduces 
precisely to the usual 4D supersymmetric case. In this paper we want 
to ask a different question: is it possible for the KK modes to take 
part in the cancellation of the Higgs mass divergence, while allowing 
conventional logarithmic gauge coupling unification? Furthermore, 
how would the weakness of gravity be understood in such a theory 
with TeV scale KK modes? One possibility is to also have sub mm scale 
extra dimensions for the propagation of gravity, but then it is not 
clear how to recover gauge coupling unification. A second possibility 
is that there is a warped extra dimension, in which case the running 
of gauge couplings is logarithmic above the mass threshold for the KK 
towers~\cite[\ref{Randall:2001gc:X}~--~\ref{Choi:2002ps:X}]{Pomarol:2000hp}.
In general $SU(3)_C \times SU(2)_L \times U(1)_Y$ theories the low 
energy gauge couplings cannot be predicted, because they depend on the 
tree-level 5D gauge couplings, which are free parameters of the 
theory.  However, if the bulk of this warped dimension has unified 
gauge symmetry such as $SU(5)$, one can show that the successful 
prediction of the MSSM for gauge coupling unification can be 
obtained~\cite{Goldberger:2002pc}.  In fact, such theories can be 
constructed by breaking the unified gauge symmetry either by 
the vacuum expectation value of a Planck-brane localized 
field~\cite{Pomarol:2000hp} or by boundary conditions imposed 
at the Planck brane~\cite{Goldberger:2002pc}.  This offers the 
possibility of exceptional economy: the warped dimension that 
generates the TeV scale and the dimension which contains supersymmetry 
breaking boundary conditions could be one and the same.

With the above motivation, in this paper we study boundary condition 
breaking of supersymmetry in warped space, in particular in a slice 
of AdS$_5$. Our aim is to construct a theory of electroweak symmetry 
breaking where a crucial role is played by the TeV mass KK modes of 
this warped extra dimension, while simultaneously solving the gauge 
hierarchy problem and addressing logarithmic gauge coupling unification.
However, before attempting to construct a model, we must study whether 
it is consistent to impose supersymmetry breaking boundary conditions 
in a supersymmetric theory in a warped 5D spacetime.

We note that it is straightforward to construct 5D warped, supersymmetric 
theories with supersymmetry broken spontaneously by a vacuum expectation 
value (VEV) located on the TeV brane~\cite{Gherghetta:2000qt}. With 
gauge interactions in the bulk, but matter and Higgs fields on the 
Planck brane, supersymmetry breaking is mediated to matter and Higgs 
via gaugino mass terms. By introducing the bulk $SU(5)$, 
one can also recover the MSSM prediction for gauge coupling 
unification~\cite{Goldberger:2002pc}. These theories are rather 
interesting, since the 5D nature for the Higgs mass cancellation 
is obtained by taking the VEV to be large.  However, in these theories 
the scale of supersymmetry breaking is in principle a free parameter 
and is not strictly related to the KK mass scale. It is also difficult 
to construct one Higgs theories with TeV brane localized supersymmetry 
breaking. In this paper we explore theories where the two scales are 
tightly related through compactifications.

The boundary condition supersymmetry breaking in warped space has been
considered before in Ref.~\cite{Gherghetta:2000kr}, but without 
addressing the issue of the consistency of the theory.  Potential 
difficulties of the theory with supersymmetry broken by boundary 
conditions in a warped fifth dimension has been noted in 
Ref.~\cite{Gherghetta:2002nr}. In this paper we study the consistency 
of the theory in detail, and during that course we develop the concept 
of symmetry breaking defects in higher dimensional spacetime. In general, 
higher dimensional theories compactified on a spacetime with boundaries 
can possess symmetry breaking defects at the boundaries. When do such 
defects lead to consistent theories, and when do difficulties arise? 
In section~\ref{sec:defect} we study the local breaking of global 
internal symmetries in flat space, and introduce a distinction between 
two types of defect: type~I (type~II) defects which are (are not) 
consistent with a gauging of the global symmetry.  For example, 
we find that the boundary condition breaking of a $U(1)$ gauge symmetry, 
or of the electroweak gauge symmetry $SU(2)_L \times U(1)_Y \rightarrow 
U(1)_{EM}$, leads to type~II defects and thus is not consistent in 
a flat fifth dimension. In section~\ref{sec:symmetry} we show that the 
defects arising when supersymmetry is broken by a boundary condition 
in a warped fifth dimension are of type~II, preventing a consistent 
construction of the corresponding supergravity theory. Despite this 
difficulty, in section~\ref{sec:model} we construct an $SU(3)_C \times 
SU(2)_L \times U(1)_Y$ model in a warped 5D background with supersymmetry 
broken by boundary conditions. Such an effective theory may follow 
from some consistent fundamental theory. We explore electroweak symmetry 
breaking in this theory when there is a single Higgs hypermultiplet. 
We also construct an $SU(5)$ theory in warped 5D spacetime where 
supersymmetry is broken by boundary conditions in the fifth dimension, 
and show that consistent phenomenology is obtained in the theory.


\section{Symmetry Breaking Defects in Higher Dimensions}
\label{sec:defect}

In this section we carefully study the notion of symmetry breaking 
defects in higher dimensional effective field theories. These defects
arise on a boundary of the bulk when the Lagrangian at that boundary
is invariant under a smaller internal symmetry than that of the bulk
Lagrangian. We find that there are two types of defect: type~I defects
arise when the reduction in symmetry from bulk to boundary is entirely
forced by the boundary conditions imposed on the fields of the theory. 
On the other hand, for type~II defects not all of the symmetry 
reduction is required by the boundary conditions. For the first kind 
of defect, the internal symmetry can be gauged, and such defects were 
considered in Ref.~\cite{Hall:2001pg} in the context of higher 
dimensional grand unified theories. We discuss these defects in 
sub-section~\ref{subsec:type1-defect} using the example of $SU(5)$ 
symmetry in 5D.  In sub-section~\ref{subsec:type2-defect}, we introduce 
the second type of defect and find that the internal symmetry cannot
be consistently gauged. In section~\ref{sec:symmetry} we extend this 
analysis of defects to the case of supersymmetry, and find that 
it has important consequences for supersymmetry breaking in truncated 
AdS$_5$ space.

\subsection{Type~I symmetry breaking defect}
\label{subsec:type1-defect}

In this sub-section we discuss the first kind of symmetry breaking 
defect. This type of defect allows the whole symmetry structure 
to be gauged, and we call them type~I symmetry breaking defects. 
To illustrate the point, in this sub-section we consider 5D theories 
compactified on a flat $S^1/Z_2$ orbifold: a line segment 
parameterized by $y: [0, \pi R]$ with the metric of the spacetime 
given by $-ds^2 = g_{MN} dx^M dx^N = \eta_{\mu\nu} dx^\mu dx^\nu + dy^2$.

Let us first consider the theory in which the bulk Lagrangian possesses 
a global $SU(5)$ symmetry: for example, the bulk Lagrangian is
invariant under the transformation 
%
\begin{equation}
  \phi \rightarrow \exp(i T^A \xi^A)\phi, 
\label{eq:global}
\end{equation}
%
where the field $\phi$ is in the ${\bf 5}$ representation, $T^A$ are 
the generators of $SU(5)$ and $\xi^A$ are arbitrary constants. If the 
spacetime we consider were non-compact, this would be the end of the 
story.  However, since we are considering the theory on a compact 
space ($S^1/Z_2$ orbifold), we have to specify the boundary conditions 
on the fields to define the theory.  Suppose we require that all 
fields in a single irreducible representation of $SU(5)$ obey the same 
boundary conditions.  In this case the full theory can possess the 
global $SU(5)$ symmetry of Eq.~(\ref{eq:global}), and the resulting 
space does not have any symmetry breaking defect. What happens if 
we impose different boundary conditions on fields in the same 
irreducible representation of $SU(5)$?  This is the situation we 
want to consider in this sub-section.

The boundary conditions on $S^1/Z_2$ are completely specified if we 
specify the conditions which the fields must satisfy at $y=0$ and 
$y=\pi R$.  In general these conditions are written as
%
\begin{equation}
  \varphi(y) = \mbox{\bf{Z}}\,\varphi(-y), \qquad
  \varphi(y') = \mbox{\bf{Z}}'\,\varphi(-y'),
\label{eq:bc-fields}
\end{equation}
%
where $y' \equiv y-\pi R$; $\varphi$ is a column vector collecting 
all the fields in the theory, while $\mbox{\bf{Z}}$ and $\mbox{\bf{Z}}'$ 
are matrices acting on this vector.  The precise meaning of these 
conditions is the following.  Although our space is only for 
$0 \leq y \leq \pi R$, we can fictitiously extend it to the domain 
$y < 0$ or $y > \pi R$ using the above equations.  Then the dynamics 
of the fields (wavefunctions of the fields) are obtained by solving 
the equations of motion in the whole covering space, including the 
terms arising from brane-localized operators.  (The importance of 
thinking in this way becomes clearer in the next section because, 
unlike the flat space case, in AdS space we cannot construct the 
theory on $S^1/Z_2$ by simple identification procedures from the 
corresponding theory on the non-compactified AdS space.)

Now, we consider the matrices $\mbox{\bf{Z}}$ and/or $\mbox{\bf{Z}}'$ 
which do not give the same boundary conditions for all the fields 
in a single irreducible representation of $SU(5)$. For illustrative 
purposes, we choose these matrices to be $\mbox{\bf{Z}} = 
{\rm diag}(1,1,1,1,1)$ and $\mbox{\bf{Z}}' = {\rm diag}(-1,-1,-1,1,1)$ 
when acting on an $SU(5)$ fundamental index. For instance, the triplet 
and doublet components, $\phi_T$ and $\phi_D$, of the ${\bf 5}$ 
representation obey the boundary conditions $\phi_T(+,-)$ and 
$\phi_D(+,+)$, where the first and second signs represent the 
eigenvalues of $\mbox{\bf{Z}}$ and $\mbox{\bf{Z}}'$.

What are the consequences of imposing the above boundary conditions?
First of all, the whole theory obviously does not have a global $SU(5)$ 
symmetry, since we have imposed different boundary conditions on, say, 
$\phi_T$ and $\phi_D$ and they have different wavefunctions.  The
transformation of Eq.~(\ref{eq:global}) is inconsistent with the boundary
conditions at $y = \pi R$, again demonstrating the absence of the
global $SU(5)$ symmetry. However, physically we suspect that the physics
at any local neighborhood of the bulk must still reflect the original
global $SU(5)$ symmetry.  This is because the effect of the boundary 
conditions at $y=\pi R$, which is $SU(5)$ violating, is suppressed by 
locality in any point in the bulk.  On the other hand, at the $y=\pi R$ 
brane, the effect of $SU(5)$-violating boundary conditions is maximal, 
and we suspect that physics will not reflect the original global $SU(5)$ 
symmetry.  For example, the wavefunction values for $\phi_D$ can be 
non-zero at $y=\pi R$, while those for $\phi_T$ must always be zero. 
This implies that it does not make sense to impose the $SU(5)$ symmetry 
on the operators on the $y=\pi R$ brane. Hence we are led to ask: 
what is the most general form of the action, and is there a symmetry 
transformation which guarantees this form?

We find the most general form for the action to be
%
\begin{equation}
  S = \int\!\!d^4x \int\!\!dy 
    \Bigl[ {\cal L}_{\rm 5D}^{SU(5)} 
    + \delta(y) {\cal L}_{\rm 4D}^{SU(5)}
    + \delta(y-\pi R) {\cal L}_{\rm 4D}^{3-2-1} \Bigr].
\label{eq:Lag-SU5}
\end{equation}
%
Here, ${\cal L}_{\rm 5D}^{SU(5)}$ and ${\cal L}_{\rm 4D}^{SU(5)}$ 
respect the full $SU(5)$ symmetry, while ${\cal L}_{\rm 4D}^{3-2-1}$ 
respects only the $SU(3) \times SU(2) \times U(1)$ subgroup of
$SU(5)$. The different pieces of the Lagrangian are invariant under 
global transformations of different size:
%
\begin{eqnarray} 
  {\cal L}_{\rm 5D}^{SU(5)}, {\cal L}_{\rm 4D}^{SU(5)}: \;\;\; 
    \phi &\rightarrow& \exp(i T^A \xi^A)\phi,
\label{eq:restricted-1}\\
  {\cal L}_{\rm 4D}^{3-2-1}: \;\;\; 
    \phi &\rightarrow& \exp(i T^a \xi^a)\phi, 
\label{eq:restricted-2}
\end{eqnarray}
%
where $A$ runs over all $SU(5)$ generators while $a$ runs over the
subset of those forming the $SU(3) \times SU(2) \times U(1)$ subgroup,
and $\xi^A$ are constant and do not depend on the coordinates. 
This is an unusual situation --- while the theory does possess 
a global $SU(3) \times SU(2) \times U(1)$ symmetry, the other 
transformations of $SU(5)$ are not symmetries, since not all pieces 
of the Lagrangian are invariant under them. In general in higher 
dimensional theories, it is useful to consider an action where 
the bulk Lagrangian and the boundary Lagrangian possess different 
invariances. We will say that such theories possess restricted 
symmetries. Where the invariance at a boundary is less than 
in the bulk we will say that there is a symmetry breaking defect 
at the boundary. In our $SU(5)$ example, we therefore find that the 
boundary conditions have forced a reduction of the original global 
symmetry to a restricted global symmetry, with a symmetry breaking 
defect appearing at the $y=\pi R$ brane. The question is whether 
this new concept of a restricted global symmetry, such as 
Eqs.~(\ref{eq:restricted-1},~\ref{eq:restricted-2}), is really 
useful: does it lead to relations amongst counterterms, for example 
sufficient to yield Eq.~(\ref{eq:Lag-SU5}) as the most general action? 
Locality suggests that this is so: at short distances ({\it i.e.} with 
large momentum) in the bulk, the effect from the $y=\pi R$ boundary 
is exponentially suppressed due to Yukawa suppression (the 4D momentum 
appears as a mass in the direction of the fifth dimension).  The same 
argument applies to the Lagrangian at the $y=0$ brane.  Therefore, 
we expect that all divergences are absorbed into the counterterms 
preserving the form of Eq.~(\ref{eq:Lag-SU5}).

This expectation is confirmed because the theory defined by 
Eq.~(\ref{eq:Lag-SU5}) possesses a conserved $SU(5)$ current in the 
bulk, and a conserved $SU(3) \times SU(2) \times U(1)$ current at 
$y=\pi R$, at the quantum level. The notion of a restricted global 
symmetry, which takes a different form at different locations, makes 
sense because current conservation occurs locally. We can demonstrate 
that these currents are conserved, for instance, by the Noether 
procedure in the path integral formalism.  We consider varying the 
fields with position dependent $\xi$'s. The position dependence of 
$\xi$'s must be consistent with the boundary conditions of the fields 
and with the form of the restricted global symmetry. Specifically, 
we have to restrict the $y$ dependence of $\xi$'s as $\xi^a(+,+)$ and 
$\xi^{\hat{a}}(+,-)$ where $a$ and $\hat{a}$ run for $SU(3) \times 
SU(2) \times U(1)$ and $SU(5)/(SU(3) \times SU(2) \times U(1))$, 
respectively.  When expanded in the complete set in the fifth dimension, 
they are written as
%
\begin{eqnarray}
  \xi^a(x^\mu,y)
    &=& \sum_{n=0} \xi_n^a(x^\mu) \cos\left(\frac{n y}{R}\right),
\label{eq:su5-gtp-1}
\\
  \xi^{\hat{a}}(x^\mu,y)
    &=& \sum_{n=0} \xi_n^{\hat{a}}(x^\mu) 
    \cos\left(\frac{(n+1/2)y}{R}\right).
\label{eq:su5-gtp-2}
\end{eqnarray}
%
Note that with $\xi^{\hat{a}}$ having boundary conditions $(+,-)$ 
we automatically have $\xi^{\hat{a}}(x^\mu,y=\pi R)=0$, ensuring 
that we restrict transformations to be in $SU(3) \times SU(2) \times 
U(1)$ at $y=\pi R$.  The rest of the procedure is the usual one.
Although the action, Eq.~(\ref{eq:Lag-SU5}), is not invariant under 
the transformation by Eqs.~(\ref{eq:su5-gtp-1},~\ref{eq:su5-gtp-2}), 
the variation is proportional to the derivatives of $\xi$'s since 
Eq.~(\ref{eq:Lag-SU5}) is invariant under transformations with 
constant $\xi$'s.  This leads to a conservation law, which tells 
us that there is a conserved current for $SU(5)$ in the bulk and on 
$y=0$, but only the $SU(3) \times SU(2) \times U(1)$ part of it is 
conserved at $y=\pi R$.

We are now in a position to consider gauging the restricted global 
symmetry of the system.  It is the gauging which distinguishes
between the two types of defects discussed in this and the next 
sub-sections.  The gauging of the restricted global symmetry is 
accomplished by requiring the theory to be {\it invariant} under 
the transformations of Eqs.~(\ref{eq:su5-gtp-1},~\ref{eq:su5-gtp-2}) 
with arbitrary functions of $\xi_n^{a}(x^\mu)$ and 
$\xi_n^{\hat{a}}(x^\mu)$.\footnote{
The gauging is possible only when the theory is anomaly free. If the 
low energy 4D theory does not have anomalies, we can in general make 
the full higher dimensional theory to be anomaly free by introducing an 
appropriate Chern-Simons term in the bulk~\cite{Arkani-Hamed:2001is}.}
Since the kinetic terms of the original Lagrangian with restricted
global symmetry are not invariant under these transformations, 
we have to introduce the connection fields $A_M^A(x^\mu, y)$, 
which are in the adjoint representation of $SU(5)$.  The boundary 
conditions for these fields are determined to be $A_\mu^a(+,+)$ 
and $A_\mu^{\hat{a}}(+,-)$ ($A_5^a(-,-)$ and $A_5^{\hat{a}}(-,+)$) 
from the transformation properties of these fields, $A_M^A \rightarrow 
A_M^A + \partial_M \xi^A + \cdots$.  The expansion then goes 
as in Eqs.~(\ref{eq:su5-gtp-1},~\ref{eq:su5-gtp-2}) with $\xi^a$ 
and $\xi^{\hat{a}}$ replaced by $A_\mu^a$ and $A_\mu^{\hat{a}}$ (for 
$A_5$'s, replace the cosine by sine and start the sum for $A_{5,n}^a$ 
from $n=1$). Therefore, we find that there is a one-to-one correspondence 
between the modes $A_{\mu,n}^A$ and $\xi_n^A$.  This is crucial for 
the consistency of the gauge theory: each gauge field requires 
a corresponding gauge symmetry.  This one-to-one correspondence 
characterizes what we call type~I symmetry breaking defects. In our 
$SU(5)$ example, gauging produces a restricted gauge symmetry (the 
transformations of Eqs.~(\ref{eq:restricted-1},~\ref{eq:restricted-2}) 
with all $\xi$ now local) yielding a consistent effective higher 
dimensional field theory below the cutoff, as discussed in detail 
in Ref.~\cite{Hall:2001tn}. Restricted gauge symmetries play 
an important role for constructing realistic higher dimensional 
grand unified theories~\cite{Hall:2001pg}, which have automatic 
doublet-triplet splitting~\cite{Kawamura:2000ev}, proton decay 
suppression~\cite{Hall:2001pg}, and an interesting new prediction 
for gauge coupling unification~\cite{Hall:2001xb}.
In the next sub-section, we consider a different kind of defect, 
which violates the above one-to-one correspondence, and consequently 
does not allow the consistent gauging of the symmetry.

\subsection{Type~II symmetry breaking defect}
\label{subsec:type2-defect}

As in the previous sub-section, we consider a theory on the flat 
$S^1/Z_2$ orbifold.  We consider a restricted symmetry where the bulk and the 
$y=0$ brane possess a global $U(1)$ invariance but the $y=\pi R$ 
brane does not.  The action of this system takes the form:
%
\begin{equation}
  S = \int\!\!d^4x \int\!\!dy 
    \Bigl[ {\cal L}_{\rm 5D}^{U(1)} 
    + \delta(y) {\cal L}_{\rm 4D}^{U(1)}
    + \delta(y-\pi R) {\cal L}_{\rm 4D}^{\times} \Bigr].
\label{eq:Lag-U1}
\end{equation}
%
Here ${\cal L}_{\rm 5D}^{U(1)}$ and ${\cal L}_{\rm 4D}^{U(1)}$ 
