,ref
0,"\refs{\jhstalk,\houches}, and led to the idea 
that one must get a good overall
picture of how many vacua the theory has and a statistical description
of their properties, to guide any such search.  The present paper is
an introduction to these ideas and some lines of work which this point
of view has inspired, details of which will appear elsewhere
\refs{\dougzel,\dougashok}.

In talking to my colleagues, I find that this point of view is
sometimes considered to be defeatist, abandoning any hope of ``real
explanation.''  I believe this is not right, and to explain why
I have provided a ``philosophical introduction'' in section 2,
expanding on a discussion in \houches.  Although ``explanation'' is
a subjective concept, the most important question along these lines is
whether string/M theory is falsifiable given sufficient theoretical
understanding and sufficient data.  In fact when one considers this
point carefully, one realizes that it may not be falsifiable.  The
basic problem is that we have not ruled out the possibility that
string/M theory contains a large or even infinite set of vacua which
arbitrarily well approximate the Standard Model and any of its
extensions we might hope to establish experimentally. \jhstalk\ %
While it is reasonable to believe that this is false and that string/M
theory is falsifiable, we intend to argue that this is a question which
can be subject to theoretical analysis and settled, we suspect long
before ``the right vacuum'' is identified.

To explain our point, let us imagine the logically simplest possible
discussion of ``string phenomenology.''  It would be to show that $N$
different vacua of string/M theory lead to Standard Model-like
physics, but with many different values of the couplings, uniformly
distributed in the space of possible couplings (we will make this more
precise in section 5).  Now the basic number characterizing our
observational knowledge of the Standard Model is the volume in
coupling space consistent with observations, measured in natural
units, $O(1)$ for dimensionless couplings and $O(M_{pl}^n)$ for a
coupling of mass dimension $n$.  If we include as couplings the Higgs
mass and the cosmological constant, this number is of order
$10^{-120-40-10-9-9-50} \sim 10^{-238}$, where we count as independent
the probability for a model to realize the observed cosmological
constant, Higgs mass, fine structure constant, electron and proton
mass, and a product of all other Standard Model couplings (being
generous in the assumed accuracy here).  This is a very high
precision, but suppose string/M theory led to $10^{1000}$ vacua which
matched the Standard Model gauge group and low energy spectrum.  If
so, it is likely that, in the absence of a selection principle,
string/M theory would lead to no testable predictions at all.  

Although this number of models may seem absurdly high, of course by
multiplying a modest number of independent choices, one can easily
produce much larger numbers.  Furthermore, our estimate for the
likelihood of matching the Standard Model is far too low, as we did
not even take supersymmetry into account.  In any case, at present we
have no meaningful estimate of the number of vacua which might
approximate the Standard Model.  Indeed, we have no real argument that
the number is finite; and we will argue below that if we are too
inclusive in our definitions, string/M theory probably leads to an
infinite number of vacua.

Thus, the primary question along these lines is to somehow estimate the
number of string/M theory vacua which should approximate the Standard
Model.  This is obviously difficult and we will not claim to have
even properly formulated the question here.  What we will do is make
some first steps towards properly formulating it, and try to make the
case that this goal could be easier than actually finding all the
vacua or even the one which describes our world.  For the reasons we
just discussed, it might even turn out that the answer to this
question will force us to drastically re-evaluate the simple idea that
``we need to find the vacuum which describes our world.''

Having further justified our approach in section 2, we begin by giving
a very sketchy overview of the problem of string/M theory
compactification in section 3.  Although necessarily somewhat
simplistic, such an overview is necessary to give any content to the
subsequent discussion.  We also justify some of our further
assumptions.  First, as has been argued by many, at our present level
of theoretical sophistication our only hope of making statements of
the generality we need is to assume that nature has spontaneously
broken supersymmetry.  For reasons we discuss, we consider models
which arise from type \I\ and type \II\ orientifold compactification
on Calabi-Yau, and develop a picture based on recent work on branes
and vector bundles, and on compactifications with flux.

We will also discuss some basic estimates for numbers of vacua,
which can be applied even in the absence of detailed understanding
of quantum corrections.  In particular, one can get estimates using
facts about the topology of moduli spaces, or using combinatorics
of brane constructions.

An important input into any claim which uses the total number of vacua
to estimate the fraction of the vacua which look like the Standard
Model, is knowledge of how the vacua are distributed among the
possibilities.  We will argue that flux stabilization of moduli typically
leads to ``uniform'' distributions.

Another point which our discussion will make, which we think will be
uncontroversial, is that the problem of constructing and classifying
string/M theory compactifications is very complicated.  Furthermore,
if one tries to summarize it in the language of effective Lagrangians,
one is led to strongly suspect that the quantities which enter
(superpotential and K\""ahler potential) are very complicated
functions.  Now there is a time-honored way to deal with certain types
of complexity in theoretical physics.  It is the statistical approach,
in which we introduce ensembles of randomly chosen systems, and study
expected values of the quantities of interest.  The great advantage is
of course that these ensembles can be far easier to formulate and
study than the true system, while the hope is that some properties of
the true system will hold in the average system, and will be visible
in the expected values.  Sometimes this approach works, and in
favorable cases one even finds that some quantities of interest are
universal, meaning that they do not depend on the details of the
ensemble but only on a few parameters which can be determined.
Clearly having such quantities would be of great value.

In section 4, we formulate some simple ensembles of $\CN=1$ effective
supergravity Lagrangians.  We also pose some questions which might be
interesting to study along these lines, and might show universality.
In fact, there is an ensemble which has already been studied by
mathematicians (for applications to quantum chaos) which can be
adapted to the problem at hand, and this will enable us to actually
cite a universality result of this type, governing the distribution of
supersymmetric vacua.

We regard such ensembles as tools for understanding and steps towards
our primary goals of properly understanding the actual set of string/M
theory vacua, and estimating the number which could describe the real
world.  We suggest an estimate for this number, at least from one
class of construction, in section 5.  Although there will be gaps in
this discussion and we will not claim that our estimate is reliable,
we felt this exercise was useful to illustrate the use of ensembles,
and to get some preliminary sense of the problem and show which parts
of it are better under control and which parts are less so.  Indeed,
we will not rule out the possibility that the number of vacua is large
enough to spoil testability, again in the absence of other selection
principles.

In section 6, we briefly summarize and conclude.

\newsec{A more philosophical introduction}

This section is an expansion on points made in \houches.  It could be
skipped by readers with a distaste for this sort of discussion.

As we mentioned in the introduction, there is a widespread feeling
that a ``theory of everything'' should make unique predictions for
the physics we observe.  String/M theory as we understand it now
does not do this, and it is this lack which is often cited as the
reason why a ``Vacuum Selection Principle'' should exist.  Of course,
this argument in itself is simply wishful thinking.

Let me indulge in a little analogy.  Suppose we were characters in a
1930's science fiction story, who lived on an electron orbiting a
nucleus.  By observation, we might discover that our particular
nucleus had 9 electrons orbiting it.  We might even formulate the
Schr\""odinger equation and find that our atom was a particular
solution.  Even without observing other atoms, by mathematical
analysis of this equation, we would discover the possibility of
hydrogen, helium and so on; the amazing fact would emerge that
(granting the quantization of electric charge, and taking relativistic
effects into account) this equation only had
about 100 solutions of the general type we observed.  

Having gotten that far, we could spend a long time looking for the
``fluorine selection principle'' which completes the story.  Of
course, if the physics were really governed by the Schr\""odinger
equation, we would never find it.

Although the analogy is a bit forced, the kernel of truth in it is
that, according to our present understanding, the consistent
unification of quantum mechanics and gravity through string/M theory
seems to lead to a definite set of solutions which resemble our world.
This is already a great deal of predictivity, and we should see how
far it can take us.

Of course, unique predictivity is not at all required for a theory
to be scientifically testable and falsifiable.  It is far more than
we expect from most theories.  Still, one hopes that a theory with
``no free parameters'' could do better than most theories.

The sense in which string/M theory is better than generic quantum
field theory, relies on the idea that vacua are local minima, or
approximate minima, of the effective potential.  While all coupling
constants must be vacuum expectation values of fields, since a generic
effective potential in a nonsupersymmetric theory will have isolated
minima, all of these expectation values will take definite values in a
given vacuum.  Even if the minimum is not unique, one still obtains
a list of potential predictions, one for each minimum, and the theory
can be falsified.

Now the expectation that a minimum is isolated, and thus that
couplings are stabilized, is a generic statement which could
have exceptions.  More precisely, coupling constants could in
principle be time dependent, but this is unnatural (for the Standard
Model couplings and especially the fine structure constant)
\bdd.  Observation of such a variation would therefore lead to much
stronger constraints on the vacuum than any mere observation of a
particular fixed value, and one will have testability in the same sense.
Similar comments apply to ``dark energy'' or ``quintessence'' (which
is not quite as unnatural).

Of course, fitting observation provides many ``vacuum selection
principles'' in a weaker sense.  The most optimistic scenario is that
future accelerator experiments will provide direct evidence for
string-like or other structure which is not naturally described by
four dimensional field theory, and which will give us information
which will directly constrain the choice of vacuum.  While this is
certainly the most attractive scenario, there are many others,
including the original ones described in \gsw, in which this appears
impossible: the energy scale of the new effects is far beyond any
conceivable experiment.  Given that the only new energy scales we have
evidence for at present are $M_{Planck}\sim 10^{19}\ \GeV$ and
$M_{GUT}\sim 10^{16}\ \GeV$, these latter scenarios must be taken
seriously and are perhaps even preferred.

Even without such direct evidence,
fitting the known data would already be quite constraining.  Besides
the obvious tests of fitting the spectrum and couplings, one can
propose indirect ones, for example to fit our present understanding of
cosmology.  An extreme example of such a test is the idea that the
vacuum energy, literally defined as the value of the effective
potential at its minimum, must in fact reproduce the observed
cosmological constant.  Other examples include the ideas that one must
obtain inflation, or that uncharged scalars in a range of masses
around $1 \TeV$ are not allowed \moduliproblem.\foot{To properly
discuss cosmological tests, one must grant that in early cosmology the
universe does not minimize the effective potential, and in general one
needs more than the low energy effective field theory.  In this
context, when we talk about a ``vacuum,'' we mean not just the
effective field theory at the minimum but whatever computations in the
underlying theory (string/M theory) are required to make the test; of
course the results of such computations will depend drastically on the
choice of minimum one is working near.  A simple and sometimes valid
picture is that one is following some trajectory which ends up at the
minimum or approximate minimum and is seeing the effective field
theory along this trajectory.  Such tests are appropriate within our
``no Vacuum Selection Principle'' assumption, but one should regard a
vacuum as passing the tests if it can do so for any of the initial
conditions within a chosen subset of non-zero measure.}  If a unique
string/M theory vacuun (or none at all) were to pass these tests, the
vacuum selection problem would be solved in a practical sense.

One difference between the principles we actually know about and the
hoped-for ``Vacuum Selection Principle'' is that to our present
understanding, no one of these tests seems more fundamental or key than
the others.  But the biggest practical difference between the two
ideas is that the ``vacuum selection principles'' are {\it a
posteriori} tests which require constructing and studying a vacuum in
great detail.  

With the present state of the art, even the basic construction and
analysis of one or a few vacua is a research program requiring
several man-months of effort to complete and several papers to
describe.  Very few vacua have been studied on even
the level discussed in \gsw.
One can try to develop better techniques, but one should
realize that the standard questions which are addressed by such
analyses, motivated fairly directly by comparison with experiment,
such as the structure of scales and hierarchies, the gauge group and 
charged matter content, indeed require at least a page to answer.
One cannot hope to analyze a model in less time than it takes to
read and understand the results, and the number of models is
such that even this is not possible for each model.

One might at least hope that some of the tests are {\it a priori},
meaning that one can restrict attention from the start to vacua with
the given property.  We are certainly doing this in restricting
attention to models with (according to present experiment) four
dimensions.  Another example is that in most perturbative
constructions, the low energy gauge group is more or less fixed very
early in the analysis, and it is easy to exclude models in which this
is (say) too small to embed the Standard Model.

A more ambitious hope along these lines is to ``engineer'' vacua,
taking observations as encoded in the Standard Model and its
extensions and directly building models which reproduce the
rough features of the observations, expecting string/M theory to
then tell us the fine details, such as values of couplings.

It is hard to argue against these ideas, which are good to the extent
that they can be implemented and actually constrain the problem.  The
main problem with them is that too much of the problem seems
unconstrained by observation: there are many very different ways to
realize the observed matter, and many ``hidden'' sectors which
directly influence the couplings and other data we hope to predict.

We should say a brief word about the anthropic principle here and will
only say that, while interesting, we feel this is raising a different
question than the one we are discussing.  Surely it is true that most
of the possible universes which come out of string/M theory do not
look like four large dimensions, do not lead to macroscopic structure
formation, or do not lead to environments suitable for any sort of
life.  Any of these conditions will also lead to tight constraints on
the physical laws, and it is interesting to explore these.  On the
other hand, we inhabit a large four dimensional universe with specific
physical laws that we determine by observation, laws surely much more
specific than any anthropic consideration we can seriously study will
lead to, and it is not at all clear whether any string/M theory vacuum
reproduces these laws.  If we know the laws, and if string theory has
a precise formulation, then the question of whether string theory can
reproduce the laws or not can in principle be answered without ever
appealing to any of the anthropic considerations.

Having defined our problem, we can say in a nutshell the main new idea
we will introduce in this work: it is to gain insight and results
bearing on the problem, by studying ensembles of theories which
approximate the true ensemble of vacua coming out of string/M theory.
We will discuss various approximation schemes below.  One general
approach is to imagine the true set of vacua as a ``sum of delta
functions in theory space,'' and to approximate these delta functions
with a similar but more general distribution of weights.  We also make
various less systematic approximations.

Although at first the distinction may seem to be splitting hairs, we
stress that the ensembles we are introducing are not probability
distributions but rather describe the distribution of vacua in
particular regions of ``theory space,'' without any implication that
one vacuum is ``more likely'' than another.  Such an ensemble is not
normalized to unit probability; rather each vacuum contributes unit
measure and the total distribution is normalized to the total number
of vacua.

The main reason we emphasize this distinction is the obvious point
that given that we observe one particular vacuum, the ensembles we
will discuss are not directly observable.
Thus certain questions which might seem to be the natural applications
of an ensemble of vacua, do not really make sense.  The prime example
is the question ``what is the probability to realize vacuum X.''  One
might imagine pushing ideas such as the ones we discuss or related
ones in quantum cosmology to the point of making statements such as
``the probability of our vacuum is $10^{-47}$, while the probability
of vacuum Y which we do not live in is $10^{-42}$ (or maybe
$10^{-52}$), but it is not clear to us what scientific conclusions one
can draw from such statements.\foot{This is not to say that a ``wave
function of the universe,'' which might be described by a
complex-valued distribution of the type we will discuss, would be
uninteresting to study.  We are just not convinced that it should be
used to compute relative probabilities of vacua.}  In particular, even
if it turned out that we live in a highly improbable vacuum according
to both quantum cosmological and anthropic considerations based on
string theory, we do not think this could be considered as evidence
against string theory.\foot{This is in the absence of a competing
theory.  Of course, if one finds a competing theory which can also
explain the observations, one must judge which appears more
predictive, plausible, natural, likely, or whatever.  All potential
competitors which we know about have far more arbitrariness than
string/M theory, in particular they depend on pre-specified adjustible
couplng constants, and this is already a reason to suspect they will
be less predictive.  One should reexamine all this if a better
competitor emerges, but it seems useless to try to provide any
guidance for this in advance.}  Only if the vacuum we live in is
literally not a possible prediction of string/M theory, meaning either
that ``it does not appear on the list'' or that we propose a well
motivated assignment of probabilities to vacua which gives it zero
probability, could we consider this as falsifying string/M theory.

Of course, there are other applications of ensembles for which the
probability interpretation makes sense.  For example, because of
statistical uncertainty in experiment and observation, we will never
get us a precise set of laws to try to make contact with, and this
uncertainty could also be summarized in an ensemble of effective
theories.  Thus, the real problem is to see if the subset of theories
which are ``reasonable'' fits to data contains any theories in the
ensemble of string/M theory vacua.

Experimental uncertainty is important, but it should be clear
that we are introducing a new type of uncertainty, more as a
theoretical device, and different from experimental uncertainty.  The
statistics which enters in understanding experimental uncertainty is
of course the bread and butter of experimental analysis and
phenomenology, and a fairly mature subject.  As we did in the
introduction, we need to talk about experimental accuracy to make our
points, and to precisely define ``the accuracy to which we know the
Standard Model'' we would need to formalize this, but we do not need
such a precise definition to make our main points here.

Finally, one idea which is certainly part of this circle of ideas is
what we call the ``purely statistical'' scenario: that all the
observed structure and couplings of the Standard Model emerge as one
undistinguished choice from a completely uniform distribution of low
energy theories.  While in the absence of any other idea this might be
attractive, for example to solve the cosmological constant problem, it
may seem implausible or even repellent when applied to other aspects
of physics which seem to point clearly to structure, such as the
unification of gauge couplings.  This may be, and our job as
physicists is in part to find structure, but it should be
realized that it may simply be that string/M theory contains both
vacua which realize observed physics by mechanism and vacua which
realize it statistically, and this would be important to know.  

We will also argue that the statistical approach is relevant for
theories with mechanisms; one can try to estimate the number of grand
unified models, the number of models with low energy supersymmetry,
and so on.  One can use ensembles to gain information about what
mechanisms are easy to realize in string theory and what mechanisms
are difficult, and whether the features explained by the mechanism
justify the choices involved.  In this sense, one could think of
an ensemble which accurately represented the set of string/M theory
vacua as providing a ``stringy'' idea of naturalness.  The discussion
in section 5 is intended to illustrate this idea.

Although for clarity we assume throughout this work that there
is no ``Vacuum Selection Principle,''\foot{One might call this
claim the ``Ultimate Copernican Principle.''} of course we do not
know whether there is one or not.
Let us conclude by giving what in our opinion are the best
arguments ``for'' and ``against'' a Vacuum Selection Principle.

The best hope is the esthetically motivated hope that observed physics
arises from a particularly ``symmetric'' or ``natural'' string
compactification.
Physicists have clearly been lucky in that the fundamental laws are
comprehensible at all, so why shouldn't our luck hold to the end.

Against this hope, one can make the claim that the Standard Model is
actually much more complicated than one might have expected on
esthetic grounds.  This is a subjective feeling, and long familiarity
with the Standard Model has perhaps dulled it for most of us, but this
point was keenly felt by physicists of the 1930's, whose intuitions
may be as valid as ours.

Still, it might be that our vacuum is at a ``symmetric'' point.  
It seems to us that this would have to mean ``symmetric'' in terms of
how it is situated in the structure containing all the vacua, so
one again needs some overall picture to make any such judgement.

The best argument we know against the idea of ``Vacuum Selection
Principle'' is simply the following.  Suppose we found a
well-motivated principle $x$, other than consistency, which predicted
string/M theory vacuum $X$.  Suppose we then determined by observation
that we actually lived in vacuum $Y$, different from $X$.
Would we conclude that string/M theory is wrong?  No, we would
conclude that principle $x$ was wrong.

Having provided more than enough philosophy for one physics paper,
let us turn to physics.

\newsec{Determining the set of string theory vacua}

A huge amount of work has been done on constructing string theory
compactifications, and at this point it is impossible to give a real
survey.  This would seem to call into question any claim that
one can discuss ``all'' string vacua in any concrete way at all.

Our claims to this effect will rest on two general hypotheses which we
feel are supported by existing work.  First, because of duality, our
constructions of string theory vacua are highly redundant: the known
vacua can be realized by many general types of construction, and in
many ways.  This leads to the idea that if one could extrapolate any
single class of construction out of the regime in which it is weakly
coupled, one would in fact reach all vacua.  Thus, if one can estimate
