,ref
arises from straightforward Kaluza-Klein reduction).  It has K\""ahler
potential
\eqn\tsixK{
K_Z = -\log \det \Im Z
}
and constant negative curvature.  Constant negative curvature is
special to this example, but negative curvature is a very general feature
of Weil-Peterson metrics.

One of the important qualitative features of this moduli space, and other
\CY3 moduli spaces, is that it has finite volume in the K\""ahler metric
\hornemoore.  This is despite the fact that boundaries can be at
infinite distance.

Finally, another important quantity which can be computed for very
general \CY3's as a function of the moduli
is the vector of periods of the holomorphic three-form,
\eqn\periods{
\Pi^i = \int_{\Sigma_i} \Omega .
}
Here $\Sigma_i$ is a basis for $H_3(M,\BZ)$.
For $T^6$, for example, these are $1$, $Z_{ij}$, 
$(\det Z)(Z^{-1})^{ij}$ and $(\det Z)$.
These enter in flux superpotentials and in black hole entropy
calculations, to name two applications we will call on.  Note that
they transform non-trivially under $SL(6,\BZ)$ and are thus
not single-valued on $\CM_c(T^{2n})$, but only on 
$Mat^+_n(\BC)$.


\subsec{Bundle and brane configurations}

This is another long story from which we will try to extract a general
picture by combining various dualities and brane arguments with
considerations in algebraic geometry.  We will base this on four
general approaches: the ``large volume'' approach involving study of
holomorphic bundles, the bound state/derived category approach,
enumerative results on curves, and the spectral cover/T-duality
approach.  Our primary question is still whether the number of
possibilities is finite and whether we can estimate it.  We will also
need to decide what fraction of constructions are likely to produce
Standard Model gauge groups and chiral matter content.

In the large volume approach, the problem reduces to that of finding
solutions of the hermitian Yang-Mills equations on $M$.  Among the
many general references on this problem are \donkron, \trieste, and
\dougzhou\ which will summarize some general facts relevant for
superstring compactification.  In particular, it is known that there
is a $n$-dimensional region within the $n$-dimensional lattice of
Chern classes (or brane RR charges, or K theory) for which stable
bundles exist.  By tensoring with a line bundle, one can always set
$c_1(V)=0$; the region is then roughly characterized by the bounds
$c_2(V) > 0$ (more precisely, one has the Bogomolov bound) and bounds
on the remaining invariant $c_3(V)$, which can only take finitely many
possible values.
% \maruyama.  
Unfortunately no effective bound is known,
but various general considerations point to a bound of the order
$|c_3(V)| < C\cdot\chi(M)$.  Furthermore, the resulting moduli spaces
of bundles (of fixed topological type) are algebraic, meaning
essentially that they can be defined by a finite system of equations
in some (large dimensional) projective space.  Although they need not
be manifolds, this is good enough to believe that there will be
finitely many vacua after quantum corrections.

Although not terribly concrete, these are at least good finiteness
results for the large volume, weak coupling limit.  Once we leave
this limit, the situation is less clear.\foot{
For example, let us consider
the dual heterotic M theory picture.  Here we can add five-branes,
wrapping effective cycles $\Sigma$ satisfying
%\eqn\anomalycond{
$c_2(V) + [\Sigma] = c_2(TM)$.
%}
There is still an argument for finiteness of the number of solutions
to this more general problem.  It is that the ``effective'' condition
in the choice of five-brane, which along with the Bogomolov inequality
tend to make both bundle and brane contributions to this formula
positive (physically this is to say that the branes and instantons
must be BPS).  the number of choices is finite here as well.
However, the Bogomolov inequality only bounds a single component of $c_2(V)$,
namely $\int_M c_2(V)\wedge \omega$, leaving open the possibility that
there are infinite sequences of stable bundles with the other
components of $c_2(V)$ running off to negative infinity.  No such
example is known, but it could be that they exist and are ruled out on
other physical grounds (we will discuss analogous examples later).
I thank Richard Thomas for a discussion on this point.}

Making a comparable discussion
for type \II\ and orientifolds requires using the general relations
between vector bundles on Dirichlet branes and combinations of
D-branes discussed on a basic level in
\refs{\polchinski,\johnson}.  This allows turning the problem of
classifying bundles into that of understanding moduli spaces of brane
configurations.

A general result which can be derived from the index theorem at large
volume, but applies to all approaches, is the following.  Consider a
configuration of $N_i$ branes of type $B_i$ and $N_j$ of type $B_j$
in type \II\ string theory,
where each brane is ``simple,'' i.e. comes with $U(1)$ gauge symmetry.
These could be branes wrapping different cycles, or carrying different
gauge connections, or whatever.  In any case, the net number
of chiral multiplets arising from open strings between these branes
is given by a bilinear form in their RR charges (or K theory classes),
the ``intersection form,'' which we denote
$$
N_{(\bar N_i,N_j)} - N_{(\bar N_j,N_i)} =
I_{ij} = -I_{ji} = \vev{B_i,B_j} .
$$
Simple explicit formulas can be found for this form in all approaches.

There are similar formulas for type \I\ and orientifolds
\refs{\sagnotti,\csu}, involving the orientifold action and the class
of the fixed plane.  Rather than use these formulas, we are going to
use a simpler description of orientifolding \dm: given a $U(N)$ quiver
theory in which the intersection numbers and ranks of gauge groups
have symmetry under a $\BZ_2$ action on the nodes, one can restrict
attention to gauge fields and matter configurations which are
invariant under the symmetry (with suitably chosen signs).  
Some of the geometric definitions of orientifolding using ``image
branes'' can be shown to reduce to this,
and we will assume that this construction is representative,
within the context we discuss below.

This allows us to find the massless matter spectrum for simple
combinations of branes.  However, this only scratches the surface of
the problem as general holomorphic bundles correspond to general bound
states of branes, typically with very complicated moduli spaces, as
one would expect for classical moduli spaces of supersymmetric vacua
of gauge theories with generic superpotentials.  
While there has been much mathematical
work on the problem, it is not easy to
explicitly describe the bundles and moduli spaces even on the simplest
threefold, projective space $\BP^3$.  The Calabi-Yau case is 
similar but harder.

On penetrating the language and other barriers,
one finds that much of this mathematics
turns out to be based on ideas which have
relatively simple physical translations, which we refer to as the
``bound state/derived category approach,'' as discussed in \trieste.
Recent work has led to a fairly good understanding of this translation
in type \II\ theory, which in broad terms can be summarized in the
claim that a supersymmetric brane configuration in type \IIb\ at weak
coupling but arbitrary K\""ahler moduli is a $\Pi$-stable object $E$ in
$D(\Coh M)$, the derived category of coherent sheaves.  The next step
in a systematic approach to the models under discussion is to classify
possible orientifoldings $\Omega$; these are in a sense $\BZ_2$
automorphisms of $D(\Coh M)$ which it is plausible to believe are
obtained by conjugating the type \I\ $\Omega$ by the action of
Fourier-Mukai transforms (T-duality).

What this means in more physical terms is the following.  We start
with a small set or ``basis'' of elementary branes, at least one for
each K theory class on $M$, and try to describe all branes as bound
states of these elementary branes and their antibranes.  This is done
by deriving the joint world-volume theory of the collection of branes;
each bound state is then a supersymmetric vacuum of this theory.

The power of this approach comes from the fact that one can find bases
with simple world-volume theories.  One looks for ``rigid'' branes,
meaning those without world-volume adjoint matter, chosen so that any
pair within the set has only open strings of a single charge (in
quiver language, a single orientation of arrows), as the
superpotential for up to two branes is then forced to be zero by gauge
invariance, and can be computed systematically for more branes.  The
set of ``fractional branes'' in an orbifold or Gepner model \ddg\
provides an example; one can find other bases by applying Seiberg
duality to this one, and the general picture is that any bound state
is a bound state of branes (not antibranes) in one of these preferred
bases.

These Seiberg dualities can have various physical interpretations
depending on the gauge couplings; at weak coupling one is simply using
different bases of branes to describe the same bound states, while
more generally couplings can flow and different dual pictures can be
valid at different energy scales \refs{\cachdual,\fiol}.  One would
need to take this into account to decide which of these Seiberg dual
theories are physically dual, and which are different at the scale of
supersymmetry breaking (below which the duality is inoperative).

The simplest examples are the hypersurfaces in weighted projective space,
a subset of the toric hypersurfaces with $7,555$ elements.
Some of these can be defined in string theory as Gepner models.\gepner\ %
In these models, there is a preferred basis of ``fractional branes,'' and a
simple description of their intersection form.  A Gepner model is
essentially a $\BC^5/\BZ_K$ Landau-Ginzburg orbifold model,
characterized by a choice of $\BZ_K$ action on $\BC_5$ and some
continuous parameters (superpotential and FI terms).  The $\BZ_K$
action can be characterized by a choice of five integers $a_i$ which
sum to $K$ and satisfy the constraint $K/a_i\in\BZ$.
One can compute the Betti numbers from this data, 
and one gets roughly $b^{1,1} \sim K$.

As discussed in \dd, this model has $K$ fractional branes $B_i$
with $0\le i < K$, whose intersection form is simply expressed as
\eqn\intnum{
\sum_j q^j \vev{B_i,B_{i+j(\mod K)}} = \prod_{n=1}^5 (1 - q^{a_n}) .
}
Enough is known about the superpotential and other data of this theory
to get moduli spaces of many simple bound states, as discussed in \dgjt.
It is known how to get similar results for general toric
hypersurfaces, although this remains to be done explicitly \katzcom.

To use such a theory in string theory, one must choose an
orientifolding and enforce anomaly cancellation.  The orientifoldings
which are simple in the quiver language are the ones we described
above which project on configurations which are invariant under a
$\BZ_2$ reflection of the quiver; there is a partially understood
relation between this and the geometric definitions of orientifold.
In any case, the resulting anomaly cancellation condition is the same
as that in the large volume type \I\ and
\IIb\ geometric orientifold constructions \roemel.  For compact
CY, the fractional branes provide an overcomplete basis for the K theory
so this determines the numbers of fractional branes up to a few
adjustible parameters.  These conditions can be worked out explicitly,
but we will only call upon their qualitative form: in examples, 
the solutions have many but not all of these numbers (so, ranks
of gauge group) non-zero, of order $O(10-100)$.  

This of course does not mean that the ranks of gauge groups need be
$O(10-100)$ as there is a lot of charged matter available to break the
gauge symmetry.  The basic assumption we will make in using these
theories in section 5 is that one can usually ({\it i.e.}, in an
$O(1)$ fraction of models) use this freedom to break this to a
specified subgroup while preserving supersymmetry; in brane language
forming bound states between some subset of the fractional branes.  If
so, then an $O(1)$ fraction of models which potentially contain the
Standard Model (by focusing on a subset of the anomaly cancelling
branes), will contain it.

This is nontrivial and often considered the hard part of the problem;
it involves details of the superpotential and D-flatness conditions
and is not always true.  Furthermore, even when it is true, the bound
states often involve fields with string scale vevs (since this sets
the scale of the FI terms), and one might worry about whether field
theory is justified.

Our main reason for nevertheless making such a claim is that the
relation between branes and geometric objects (bundles, objects in
$D(\Coh M)$ etc.) relates this question to questions such as whether
there is a stable bundle of the required topological type (and similar
questions) for which there is independent information.  As we
discussed earlier, this is true for some finite region in charge
space, and the anomaly cancellation conditions are usually such that
$c_2(V)>0$, so it seems reasonable to expect an $O(1)$ fraction of
solutions to the anomaly cancellation conditions to sit in this
region.  We should say that far more testing of this claim is possible
and would be desirable.

Another relation which lends some support to this idea is the relation
between brane configurations (at weak coupling) and black holes.  
This is obtained by reinterpreting the space-filling branes as
particles in the related \IIa\ string theory (formally, T-dualizing
the Minkowski space dimensions).  From the world-volume
point of view, this is reducing the supersymmetric gauge theory to
quantum mechanics, but many qualitative aspects such as stability and
supersymmetry breaking, and the estimate $N_{vac} \sim \chi$ (the
Euler character of the moduli space), are preserved under this.

By going to the strong string coupling limit, such a brane system
turns into a rather different system, a black hole.  The by-now
familiar idea that the entropy of a D-brane world-volume theories
should match that of a black hole in supergravity \sv\ provides a very
different way to get such estimates, by using the attractor mechanism
in supergravity.  It also provides a very different way to show
that certain brane configurations can form stable bound states:
if this entropy is non-zero, such a configuration must exist
\refs{\moore,\denef}.  This confirms the idea
that there is a finite volume region in the charge space for which
such bound states exist.\foot{
One should note that the black hole entropies,
which tend to go as $c^{N^2}$, are not in general a good estimate
for $N_{vac}=\chi$, as the black hole states are expected to
contribute to $\chi$ with signs.  In fact one typically obtains
$\chi\sim c^N$. \vafabh}

We have now laid out a certain style of analysis of the quiver gauge
theory of fractional branes at the Gepner point, on which we will base
the discussion in section 5.  These are however only
a subset of the rigid branes.  More rigid
branes can be obtained by performing Seiberg dualities on the
original quiver theory.  In the well understood examples (orbifolds),
all the rigid branes can be obtained this way, and we will assume
these are representative.  Seiberg duality acts
in a relatively simple way on quiver theories with no adjoint matter
\refs{\sei,\bea,\cachdual,\fengdual,\bd};
one picks a node of the quiver and applies the
duality of \sei\ to this node, treating the other gauge groups
as non-dynamical.  One can check that dualizing the $n$'th node
acts on the intersection numbers as
\eqn\seiint{
I_{ij} \rightarrow I_{ij} - 2 I_{in} - 2 I_{nj} + I_{in} |I_{nj}| .
}
This provides a large number of quiver theories from a single CY.
It is not known how many are distinct; the naive estimate $2^K$
which comes from allowing duality on each node independently is
clearly an overestimate in the known examples.  There is a (still
not well understood) relationship between these duality actions,
the CY monodromy group (acting on K\""ahler moduli space) and the
``phase structure'' of \agm, which suggests that the number should
be comparable to the number of ``phases'' of the model, which
is probably a low power of $K$.  It would be nice to have similar
results for the orientifolded theories, but Seiberg duality for these
has not been studied systematically.

We will use these results below to estimate numbers of brane constructions
which can realize the Standard Model.  Let us conclude by
briefly discussing the final two classes of construction.  A particularly
simple class of models is one in which the orientifolding fixes only
curves, so that anomaly cancellation can be accomplished using only
D$5$-branes wrapped on curves.  An example is given in \ach.
An advantage of this type of model is
that there is a highly developed technology for counting configurations
of curves on Calabi-Yau's, the ``original'' mirror symmetry
technology.  By wrapping branes on curves,
this can be used to count numbers of vacua directly.  The result
can also be interpreted as an Euler 
character of the moduli space of curves of the given degree.
This leads to an estimate of the form $c^N$, exponential in the
charge of the branes (degree of the curves).

Finally, we should mention the spectral cover construction
\refs{\donagi,\fmw}, which is a
very powerful and general construction of bundles on elliptically
fibered \CY3's.  The physical idea here is simple: by T-dualizing on
the fiber, a configuration of D$9$-branes carrying a very general
bundle can be turned into a configuration of D$7$ and lower
dimensional branes wrapping the base.  Generically, these D$7$-branes
will sit at different places in the fibration, in which case the
bundle data on these is simply the choice of a line bundle on each
D$7$-brane.  The only {\it a priori} condition on the bundles one gets
out is that the T-dual of the class of the D$9$ on the dual fibration
must be absent; even this restriction can be overcome by further
generalization (physically, taking bound states of the result with 
D$7$-branes in this remaining class).
Counting vacua in this type of construction thus boils down to counting
the configurations of D$7$-branes of a particular charge.

A simpler example which is related by T-duality to the ones we
discussed is to take space-filling D$3$-branes at points in $M$, as in
\kst.  If no superpotential is generated, the moduli space of $N$ such
branes is obviously $M^N/S_N$.  This space has Euler character roughly
$(\chi(M)+N)!/\chi(M)!N! \sim 4^N$ if $N \sim \chi(M)$, 
neglecting the singularities where branes
coincide.  Treating these singularities as quantum theories with
enhanced gauge symmetry can lead to larger estimates, but still
$O(c^N)$.

\medskip

This was a long subsection, so let us recap some of the main points.
First, the evidence seems consistent with the idea that there are
finitely many choices at this stage, which is important, as one
expects a finite fraction of these configurations
to match the Standard Model.  Second, a generic gauge theory
with $N$ branes would be expected to contribute a $c^N$
multiplicity of vacua.  Finally, we have systematic techniques for
constructing large numbers of configurations, which we will use
later to discuss the difficulty of realizing the Standard Model.

\subsec{Flux contributions and the cosmological constant}

Besides metric, Yang-Mills and brane degrees of freedom, string/M
theory contains various $p$-form gauge fields.
All of the well understood compactifications can be generalized
by turning on background flux for these gauge fields, as first
discussed in \stromtor\ and generalized in many works
(a few are \refs{\psflux,\beckerG,\dasgupta}).
This flux leads to a potential
energy (the ``flux potential'') which can be explicitly computed
in many examples, at least at weak coupling.

This work has led to two important physical ideas, which we will
review and build upon.  First, since the potential energy from the
flux depends on the moduli of the internal manifold in a fairly
complicated way, one expects it to have isolated minima; in other
words the moduli are stabilized.
This idea has a long history; recent work has focused on the use
of exact results for the flux potential, and 
in work of Giddings, Kachru and Polchinski
\gkp, Acharya \achflux\ and Kachru, Kallosh, Linde and Trivedi \linde,
it has been shown that moduli can be stabilized at finite coupling and
volume, as we discuss shortly.

Second, Bousso and Polchinski \bousspol\ have suggested that the large
number of independent flux contributions can lead to a large set of
vacua with a closely spaced spectrum of cosmological constants, so
that it becomes likely that vacua exist with acceptably small
cosmological constant.  Related ideas were proposed in \feng.

By the rules we stated in the introduction, this can count as a
solution to the cosmological constant problem, because we are not
insisting that there be a mechanism or selection principle which picks
out the observed case.  One still needs to check that a vacuum with
the appropriate $\Lambda$ exists, is metastable, can have reasonable
cosmology, and so on.  Since we observe $\Lambda>0$, the constraint of
metastability seems to be mild, because most likely decays are to AdS
vacua, which by general considerations of quantum gravity are highly
suppressed or impossible \refs{\coleman,\banks}.

Thus, fluxes seem to provide concrete candidate solutions to some
important problems, as well as potentially dominating the other
possible types of vacuum multiplicity.

We start again with a broad outline to make some basic points.
Let $C^{(p)}$ be a $p$-form gauge field, and $F^{(p+1)} = dC^{(p)}$ be
its field strength.  Lorentz invariance of the vacuum is preserved
either by electric $4$-form flux in Minkowski space, possible for
$p\ge 3$ if there are $p-3$ cycles, or by taking a magnetic $p+1$-form
flux in the internal space.  These are interchanged under duality
$*F^{(p+1)}=F^{(D-p-1)}$, so by considering both dual representations
of the gauge field, we can restrict attention to magnetic fluxes.

In a minimal energy flux configuration, $H^{(p+1)}$ is a harmonic form,
and is characterized by the cohomology class
of the field strength
\eqn\fluxquantum{
N = {1\over e}[F^{(p+1)}] \in H^{(p+1)}(M,\BZ) ,
}
a $J=b_{p+1}$-component vector.
For physical reasons discussed in \refs{\polchinski,\bousspol},
the flux must satisfy a quantization condition
$\int_\Sigma H^{(p+1)} = c N/M^p$; {\it i.e.} 
$e = c/M^p V_{p+1}$ in \fluxquantum, where $V_{p+1}$ is the volume
of the wrapped cycle, and $M$ a fundamental scale, typically $O(M_P)$
where $M_P$ is the higher dimensional Planck scale.

The flux contributes its potential energy to the effective potential:
\eqn\fluxpotential{
V_{flux\ 1} = \int_M H \wedge *H \sim M_{pl}^2
 {N^2 c^2\over M^{2p} V_{p+1}^2} ,
}
where the four dimensional Planck scale is related to the $D$
dimensional Planck scale as $M_{pl}^2 = M_{P}^D V_M$.
This formula might be modified by gravitational backreaction effects,
stringy and quantum corrections.

Let us now review the discussion of Bousso and Polchinski.  Following the
ideas of Brown and Teitelboim \brown, to get a small
cosmological constant, one assumes that the effective potential
is the sum of a large negative term $-\Lambda_0$ and the flux contribution
\fluxpotential.  Although flux quantization forces \fluxpotential\ to
take one of a discrete set of values, if there are enough distinct choices
of flux whose energy spacings are small compared to $\Lambda_0$, it will
be likely to find a discrete choice with cosmological constant within
the experimental bound.  

The necessary condition for this can be stated most simply in terms of
the number distribution for vacua with a given flux potential $V$,
a measure $d\mu(V)$ defined by
\eqn\fluxmeasure{
d\mu(V) = \sum_{T\in theories} \delta(V-V(T)) .
}
We will discuss this type of ``ensemble observable'' in more depth in
section 4, but in this simple example the definition should be clear.
In terms of this distribution, the condition is then simply
\eqn\cccond{
1 << \int_{\Lambda_0+\Lambda_{min}}^{\Lambda_0+\Lambda_{max}} d\mu(V) 
}
where $(\Lambda_{min},\Lambda_{max})$ are the experimental bounds
on the cosmological constant.  Evaluating \fluxmeasure\ using
\fluxpotential\ gives approximately
$$\eqalign{
d\mu(V) &= \sum_N \delta(V-{M_{pl}^2 N^2\over M^{2p} V_{p+1}^2}) \cr
&\sim {\Vol(S^{J-1})\over 2}\int dN^2 N^{J-2}
 \delta(V-{M_{pl}^2 N^2 \over M^{2p} V_{p+1}^2}) \cr
&\sim {\Vol(S^{J-1})\over 2}
 \left({M^{2p} V_{p+1}^2 \over M_{pl}^2}\right)^{J/2} V^{J/2-1} dV.
}$$
Replacing the sum with an integral is reasonable when \cccond\ is true,
so one gets a condition
\eqn\naivebp{
1 << \Delta\Lambda
 \left({M^{2p-D} V_{p+1}^2 \over V_M}\right)^{J/2} \Lambda_0^{J/2-1} .
}

One can then combine this condition with constraints on the other
quantities entering \fluxpotential\ to get a picture of the class
of models in which this works.  First, if the geometry of the internal
space is ``not too anisotropic'' ({\it i.e.} we are away from limits
or singularities in moduli space), we can take
$V_{p+1} \sim V_M^{(p+1)/(D-4)}$.  \naivebp\ then
reduces to
$$
{\Lambda_0\over\Delta\Lambda} << (\Lambda_0 V_M^{4/D})^{J/2} .
$$

The appropriate bound on $\Lambda_0$ is not at all obvious.  Indeed,
it is not immediately apparent where negative contributions to the
vacuum energy will come from, and once we find them, we will face the
potential problem that we will find a series of vacua in which
$-\Lambda_0$ can become arbitrarily negative, leading to an infinite
set of vacua and complete loss of predictivity.  

The simplest guess is $\Lambda_0 \sim M_{pl}^4$.  This works well in
large extra dimension scenarios, as $V_M$ is large.  In the
traditional weakly coupled string models, with $V_M \sim
