,ref
another copy of the Standard Model, or a different fixed point theory),
it is plausible to claim that these sectors dominate the vacuum 
multiplicity.

While these assumptions are clearly an oversimplification, we will
still see in section 5 that interesting points will emerge from the
discussion.

\subsec{The main point}

To seriously address any questions of string phenomenology, we need to
make a discussion such as the one we just made, which exhibits the
various choices in string theory compactification, and derives the
consequences of each choice for the resulting four dimensional
effective theory.

Our discussion was terribly long and technical, to the point where it
is very hard to get any picture of how many possibilities will come
out, and how they are distributed.  And it skipped many important
points; a comprehensive discussion of these models would be far longer.

This is just how string theory is at present, and string theorists
must do the work to exhibit the potentially relevant vacua, to have
any solid foundation for string phenomenology.  Furthermore, since
most of the choices and consistency conditions have little direct
relation to the phenomenological considerations, it is difficult to
see how to do this without listing all or at least a representative
subset of the vacua.

But if listing the vacua produces an answer which is too 
complicated to think about, and the description of the procedure which
leads to the list of vacua is too complicated to think about,
then what can we do ?

\newsec{Ensembles of effective Lagrangians}

As one changes perspective from the problem of ``finding the right
vacuum'' to characterizing all the vacua, one realizes that the idea of
``list'' in many respects gives far more information than we actually
want, and is inflexible in a way which makes progress difficult.  A
more flexible concept might be an ``ensemble'' of vacua which assigns
a weight to each vacuum.  Armed with this concept, we might try, for
example, to find a simple ensemble which approximates the true ensemble
of superstring vacua well enough to address the goals we stated
in the introduction.

Now a vacuum, for present purposes, is a critical point of an
effective potential.  Most of its structure comes from where this
critical point sits in the effective theory, in the sense that small
fluctuations around it govern the spectrum and interactions of
particles.  Since we need to keep so much structure of effective
theory to say anything useful, we may as well change our concept to
instead define an ensemble of effective theories.  In words, we take a
subset of the data we need to specify the effective theory: field
content, potential, and other terms in the Lagrangian, and make this
particular data our precise definition of ``theory''; we then specify
an ensemble by giving a weight function on the space of these
theories.  A given theory could contain any number of vacua, and the
resulting ensemble of vacua is the sum of all of these vacua, each
weighed by the weight of the effective field theory which includes it.

The main examples we will discuss are ensembles of
$\CN=1$ supergravity theories with chiral multiplets and no gauge
multiplets.  The effective potential is then determined by a choice
of configuration space $\CC$, K\""ahler potential $K$ and
superpotential $W$.  These satisfy the usual rules of supergravity
\wessbagger: in particular, the K\""ahler form $\omega=\p\pb K$
is positive definite (since it is the kinetic term for scalar fields),
and the superpotential is a section of a line
bundle $\CL$ over $\CC$ such that $c_1(\CL)=-\omega$.

Physically, we will think of our supergravity Lagrangian as
a possible effective Lagrangian which might arise from some more
fundamental theory (e.g. string/M theory), defined in the usual
Wilsonian sense.
First, we have implicitly chosen an energy scale $M$.  All quantum
effects of virtual states with energies $E>M$ are included in
the effective Lagrangian.  On the other hand, the Lagrangian contains
all fields required to describe all particles with mass $m\le M$
in every vacuum.  It may also contain fields with $m>M$.

There is a lot to say about this dependence on scale and the role
of the renormalization group in these problems, and this has
been discussed in the phenomenology literature.  However,
for what we try to make precise in this paper, namely problems
involving counting of vacua and rough estimates of likelihoods to
match couplings, we do not need such a precise definition, and
can think of $M$ as infinitesimal.
In this case, a vacuum is defined as a critical point of the effective
potential, ${\p V/\p \phi^i} = 0$.

Thus, a ``theory'' for us is a triple $(\CC,K,W)$, and the set of
theories as the set of triples up to the usual geometric
identifications (field redefinitions).  This set has components in
each of which $\CC$ has a definite dimension, topology and complex
structure.  Each component is an infinite dimensional manifold,
a point of which is a choice of $K$ and $W$.

One can define natural metrics and even measures on these infinite
dimensional manifolds.  We will not need to go far into the
mathematics of this for the simple examples we give.  In any case,
given the ability to make such definitions, we can specify an ensemble
of theories by giving an integrable measure on the set of theories.
We will not require that it is unit normalized.

Let us give a simple example, to make this concrete.  Our example will
bear an obvious resemblance to the Gaussian ensembles of random matrix
theory.  It is a particular case of a class of ensembles studied as
models of quantum chaos, as we discuss below, and of course has
similarities to models commonly studied in the physics of disordered
systems such as spin glasses and random potential models.  Many have
suggested this general analogy (e.g. see \houches), and indeed spin
glasses share the $c^N$ multiplicity of vacua we observed in the
previous discussion \spinglass.  Below, we will add to these points of
similarity, the new observation that the class of ensemble we discuss
can be obtained by a simple limit of the flux superpotential.

We choose
$\CC$ out of the possibilities $\BC$, $\BC^2$ and so on, of arbitrary
dimension $n\ge 1$, and call the $n$ chiral superfields $z_i$.  Given a
particular choice for $n$ and thus $\CC$, we choose the K\""ahler
potential
$$
K = \sum_{i=1}^n |z_i|^2 .
$$
and superpotential
$$
W = \sum_{\vec I} w_{\vec I} z^{\vec I} ,
$$
a polynomial of degree $d$, where $z^{\vec I}=z_1^{I_1}\cdots z_n^{I_n}$.
Such a polynomial has $c(d,n)=(d+n)!/d!n!$ independent coefficients 
(the number of degree $d$ homogeneous polynomials in $n+1$ variables).

One ensemble (a Gaussian unitary ensemble or
``GUE'', since it respects $U(n)$ symmetry)
could be defined by taking the coefficients 
$w_{\vec I}$ to be complex.  We could define a different ``GOE''
ensemble by taking the coefficients real, which would be appropriate if the
systems of interest had CP symmetry.
In either case, we choose the coefficients with weight
$$
[d\mu(W)] = \left({\pi\over\alpha}\right)^{c(d,n)}
 [\prod_{\vec I} dw_{\vec I}] e^{-\alpha \sum_{\vec I} |w_{\vec I}|^2} .
$$
(this is unit normalized).

Finally, we can specify a weight $P_n$ for each of the possible
dimensions $n$.  If we were introducing randomness purely as a
theoretical device to model generic superpotentials, we should take
$P_n=\delta_{n,N}$, {\it i.e.} simply fix $n$ and unit normalize.  
On the other hand, if
the randomness reflects a multiplicity of effective field
theories arising from a more fundamental theory, we should choose
the $P_n$ to reflect these multiplicities.

Clearly this simple example can be generalized in many ways, and
we will discuss a few aspects of this below.
One can also generalize
it to add gauge symmetry.  One would have a weight $P(G)$ for
each particular choice of gauge group $G$, and randomly 
chosen actions by isometry of the gauge group on $\CC$ (in the
simple example of flat $K$ this is the choice of matter representation),
of Fayet-Iliopoulos parameters, and of more exotic couplings.

We define the expected number
of vacua, meaning critical points of $V$, in the ensemble, as
\eqn\Nvac{
\vev{N_{vac}} = \sum_\CC P(\CC)
 \int [d\mu(K,W)]\ \int_\CC\ [d^{2n}z] \delta^{(2n)}(V')~ |\det V''| .
}
The determinant is present in order to count each isolated vacuum with
weight $1$, and give a coordinate-independent result.
There are some variations one can make on this which we will discuss
shortly.

The first point we want to make is simply that given an ensemble,
one could compute mathematically or estimate on a computer the
number $\vev{N_{vac}}$.  
We will discuss some results of this type
in an extremely simplified example below, and in more examples elsewhere.

Indeed one could in principle compute
the expectation value of any physical observable in a given 
theory in the ensemble, by integrating the observable over the
ensemble.  For example, one could compute the distribution of
cosmological constants,
\eqn\cosdist{
\rho(\Lambda) = {1\over N_{vac}}\sum_\CC P(\CC)
 \int [d\mu(K,W)]\ \int_\CC\ [d^{2n}z] \delta^{(2n)}(V')~ |\det V''| ~
 \delta(\Lambda-V) .
}

The second point is that some results need not depend on the details
of the ensemble.  As the simplest example of this, since the number of
critical points of a generic function is invariant under small
perturbations of the function, the number of vacua will remain invariant
if we ``fuzz out'' the ensemble, replacing delta function contributions
to the measure with highly peaked functions of unit weight.  This
allows a lot of potential scope for simplifying the ensemble.

One can also entertain the hypothesis that a sufficiently complicated
potential will start to look like a generic member of a simple
ensemble.  This is expressed more precisely in the idea of
``universality,'' which we will return to.

Let us define some related observables which are more or less precise
than \Nvac.  First, one can discuss the number of perturbatively
stable vacua, meaning those without tachyons.
In Minkowski space (zero cosmological constant), this means of course
that the matrix $V''$ must be positive definite (it is related to the
mass matrix by the positive definite metric on field space).  Thus,
we define
\eqn\Nstablevac{
\vev{N_{stablevac}} = \sum_\CC P(\CC)
 \int [d\mu(K,W)]\ \int_\CC\ [d^{2n}z] \delta^{(2n)}(V')~ |\det V''|
~ \theta(V'')
}
where the $\theta$ function applies to each eigenvalue of $V''$.

One can go on to make the question more specific by imposing
metastability with respect to tunneling (obviously this is harder
to treat analytically, but some useful tricks appear in the theory
of spin glasses \spinglass), or ask for vacua with certain qualitative
properties.

One can also consider less specific questions of this type.  For
example, the integrand in \Nvac\ is not the simplest one could consider.
A simpler possibility is
\eqn\Nindex{
\vev{I_{vac}} = \sum_\CC P(\CC)
 \int [d\mu(K,W)]\ \int_\CC\ [dz] \delta^{(2n)}(V')~ \det V'' .
}
where we do not take absolute value of the determinant, and thus
count vacua with signs $\pm 1$ depending on its sign.  This type of
signed measure is familiar in supersymmetry, 
topological field theory, and so on,
and produces the supergravity index \sgindex.
As such, it should be much easier
to compute, yet also gives information which might be useful in
understanding $N_{vac}$ or even its more specific relatives.

\subsec{Estimated number of nonsupersymmetric vacua}

To illustrate how very simple estimates of numbers of vacua can be
made in this language, we consider an ensemble of globally
supersymmetric theories with a Gaussian distributed superpotential,
and explain how to get estimates for the density of supersymmetric
vacua and nonsupersymmetric vacua.

We start with the ensemble of theories with $n$ chiral superfields $z^i$
taking values in $\BC^n$, and a superpotential
\eqn\degreethree{
W = w + a_i z^i + b_{ij} z^i z^j + c_{ijk} z^i z^j z^k .
}
The $(n+1)(n+2)(n+3)/6$ coefficients are taken from independent distributions
with the Gaussian weight
\eqn\gaussone{
d\mu[W;\alpha] = [dw da db dc] N(\alpha) \exp -\alpha 
 \left( |w|^2 + \sum_i |a_i|^2 + \sum_{i\le j} |b_{ij}|^2 + \sum |c|^2 \right)
}
where $N(\alpha)$ is chosen to normalize the total weight,
$$
1 = \int d\mu[W;\alpha] .
$$
This leads to
$$
N(\alpha) = \left({\alpha\over\pi}\right)^{(n+1)(n+2)(n+3)/6} .
$$

Note that this ensemble is symmetric under $U(N)$ rotations
$z\rightarrow Uz$, but it is not translation invariant; taking
$z\rightarrow z+z^i$ changes it.  In particular, the lower moments of
$W$ have a nonzero expectation value in the shifted fields.
One can find ensembles with more symmetry (say $U(n+1)$)
at the cost of changing the K\""ahler potential, and one might expect
these to play a more important role in describing more natural
starting points such as string/M theory.
In any case, this ensemble is fine for purposes of illustration.

We start by considering the expected number of supersymmetric vacua.
Of course we already know this for the superpotential \degreethree.
We need to solve the $n$ equations $W'=0$.  Each of these has degree
two, and a generic system of $n$ degree two equations in $n$ unknowns
will have $2^n$ solutions.

Let us instead do this using the formula
\eqn\Nsusyvac{
\vev{N_{susy}} = 
 \int [d\mu(W)]\ \int_\CC\ [dz d\bz]~ \delta^{(n)}(DW)~ \delta^{(n)}(\bar DW) 
~|\det D^2W|^2 .
}
Since we are discussing global supersymmetry, we take $D_i=\p/\p z_i$ the
usual coordinate derivative.  It is clear at this point that the constant
factor $w$ will drop out of our considerations, so we now set $w=0$
(and remove the corresponding factor from $N(\alpha)$).

One advantage of this approach is that we can get not just a total number
but an expected density of supersymmetric vacua $d\mu_{susy}(z)$, defined
by
\eqn\Nsusyvac{
d\mu_{susy}(z) = [dz d\bz]  \int [d\mu(W)]\ 
\delta^{(n)}(DW(z)) \delta^{(n)}(\bar DW(\bz)) 
|\det D^2W(z)|^2 .
}
At a fixed $z$,
this is a simple Gaussian integral.  The integrand depends on $z$, but
in a relatively simple way.  

One can explicitly compute the density as a function
of $z$.  To make our point, we will just do it for $z=0$.

At $z=0$, we have $D_iW(0) = a_i$ and $D_i D_j W(0) = b_{ij}$.
The delta functions can simply be used to set $a_i=0$, while the
values of $c$ now drop out of the discussion.  This leads to
\iffalse
\eqn\Nsusyvaczero{\eqalign{
d\mu_{susy}(0) &=
\left({\alpha\over\pi}\right)^{n(n+3)/2} 
[dz d\bz] 
\int [db] e^{-\alpha \sum |b|^2}
|\det_{i,j} b_{ij}|^2 \cr
&= \left({1\over\pi}\right)^n [dz d\bz]
\left( {C\over 2^{n}} \right) .
}}
\fi
\eqn\Nsusyvaczero{
d\mu_{susy}(0) =
\left({\alpha\over\pi}\right)^{n(n+3)/2} 
[dz d\bz] 
\int [db] e^{-\alpha \sum_{i\le j} |b_{ij}|^2}
|\det_{i,j} b_{ij}|^2
}
This Gaussian integral is not hard to do; the result is
the probability that a randomly chosen superpotential will have a 
supersymmetric vacuum at the origin, or equivalently the expected
number of vacua at the origin in this ensemble.
It is not much harder to compute the density $d\mu(z)$,
which turns out to have power law falloff.

Let us compare this to the computation
of the expected density of all vacua $V'=0$, including
nonsupersymmetric vacua, evaluated at $z=0$.  Starting with
\Nvac\ with $V=\sum_i |D_iW|^2$ and following the same approach leads to
\eqn\Nallvaczero{\eqalign{
d\mu_{vac}(0) =
\left({\alpha\over\pi}\right)^{(n+1)(n+2)(n+3)/6-1} 
&[dz d\bz] \cr
\int [da\ db\ dc] e^{-\alpha \sum |a|^2 + \sum |b|^2 + \sum |c|^2} 
&\delta^{(n)}(b_{ij} a^*_j) \delta^{(n)}(b^*_{ij} a_j)
|\det M|
}}
where $M$ is the matrix of second derivatives $V''$, a
$2n\times 2n$ hermitian matrix
$$
M_{i,j} = \left(\matrix{
b_{ik}b^*_{kj}& c_{ijk} a^*_k \cr
c^*_{ijk} a_k & b_{ik}b^*_{kj} }\right) .
$$
One then solves the $\delta$ function constraints for $b$,
since in a nonsupersymmetric vacuum $a\ne 0$, and proceeds above
to obtain a density,
which could be integrated to obtain the total expected number
of nonsupersymmetric critical points.  Such results and the
more interesting expected number of stable nonsupersymmetric vacua
will be discussed in \refs{\dougzel,\dougashok}.

\subsec{Universal results}

The first question one should ask about the type of result we just
described is to what extent they are particular to a specific
ensemble, and to what extent they reflect properties shared by many
ensembles and which it is reasonable to believe are shared by the
ensemble of string/M theory vacua.

In general, results do depend on the specific choice of ensemble.  In
\gaussone, this includes the choice of equal variances for $a$, $b$
and $c$; clearly the choice of distribution which weighs discrete
factors such as gauge group and matter content will be even more
important.  Claiming that a specific choice reproduces some aspect of
the ensemble of string/M theory vacua is therefore non-trivial.  Thus,
a good answer to this question requires some ability to work with the
string/M theory ensemble, and this is why the simpler considerations
of this section would have little content without the more complex
discussion of section 3.

However, the most interesting and potentially useful questions would
be those whose answers display universality.  There are various ways
one can try to make this concept precise, but one typical and standard
notion is to consider a family of ensembles parameterized by an
integer $N$, and claim that the $N\rightarrow \infty$ limit is a
universal function of a few parameters which can be extracted from the
ensemble, while $1/N$ corrections to the leading behavior may be less
universal.

In work of Bleher, Shiffman, and Zelditch on quantum chaos
(\refs{\zelditch,\zelreview}, and see also the references there); such
a universal limit is discussed for essentially the ensemble we just
discussed.  One considers a compact K\""ahler configuration space
$\CC$, and a positive line bundle $\CL$.  One then considers a family
of Gaussian distributed holomorphic sections $W_N\in \CL^N$ with the
measure (here $({\rm vol_\omega})=\omega^n/n!$ is the volume form):
$$
d\mu[W] = \exp -\int_\CC ({\rm vol_\omega})\ e^{N\cdot K} |W|^2 ,
$$
and considers average properties of the critical points of $W$.

As $N\rightarrow\infty$, using the simple estimates we discussed earlier,
the number of critical points will grow as $N^n$ (for $n$-dimensional
$\CC$), and thus one expects their average spacing to go as $N^{-1/2}$.
In the limit, the distribution of critical points becomes universal:
\eqn\expcrit{
d\mu[W] = {(\rm vol_\omega}) \times c_n~N^n~ (1 + \CO({1\over d})) ,
}
with $c_n$ a universal dimension dependent constant.

These results are essentially local and one might expect them to hold
for suitable sums over sections even in the case of more physical
interest, in which $\CC$ is noncompact.
This supports our earlier formula \sgindex\ as it gives a limit of
the problem in which this formula becomes exact.

If one focuses on the structure at the scale of the average spacing
between vacua by defining $Z = N^{-1/2} z$, one finds in addition that
correlation functions involving the products of densities of vacua at
distinct points become universal.  In this sense, the local structure
of the effective field theory becomes universal.  Physical
applications of such results might include computing the probability
that another nearby vacuum could destabilize the vacuum of interest,
or that flow from one critical point to another realize sufficient
inflation.  Such questions will be studied in \dougzel\ and future
work; these are questions which one has little hope of addressing at
present except in ensembles.

Finally, the parameters which entered into this example (derived from
the K\""ahler metric and parameters of the distribution) will control
the expected number of nonsupersymmetric vacua as well.  This is the
sense in which we would claim that general information about
supersymmetric vacua can determine numbers of nonsupersymmetric vacua,
which we will explore in \refs{\dougzel,\dougashok}.

\subsec{The ensemble of string/M theory vacua}

Besides explicitly defining ensembles, one can implicitly define
ensembles.  Obviously the primary one we are interested in would be an
``ensemble of all theories coming out of string/M theory.''  This
ensemble is not computable at present, but perhaps if we can precisely
define it, some approximation to it will someday be computable.

The basic idea one wants to implement is the following.  In section 3
we discussed the many, many choices which enter into the construction
of a compactification in string/M theory.  As is much discussed in the
literature, each of these choices leads to a low energy effective
Lagrangian, with specific field content and couplings, valid in a
certain region of configuration space.  We want to define an ensemble
for which the measure which is a sum of delta functions, one for each
effective field theory which is obtained from a given choice of the
discrete compactification parameters.

Each effective field theory in the ensemble so defined will in general
describe many vacua.  Although so far we have stressed the idea that
the ensemble will contain distinct effective field theories each
corresponding to one choice of the compactification data, we could
also imagine that a given compactification is not described by a
single effective theory but rather by a collection of ``dual
descriptions,'' each with partially overlapping regions of validity.
To do this well, we must generalize our definition of ensemble, for
the following reasons.

First, we may only trust a given effective field theory if the fields
live in a certain region of configuration space.  This is definitely
not a problem of principle and there is no {\it a priori} restriction
on the region which can be used.  In particular, there is no reason
that one effective field theory cannot be valid over a range of
configurations with relative distance large compared to $M$, or even
large in Planck units.  However, it often does happen that a specific
derivation breaks down in such circumstances (typically because new
light states come down), so one needs to allow for this type of
partial information.  Now there is a way to deal with it given our
previous definitions: we simply take $\CC$ to be a manifold with
boundary, which cuts out the regions we do not trust.  However, this
will lead to many complicated regions $\CC$ and a complicated
description.  We would prefer to describe this information more
simply.

Second, different effective field theories can be dual, and describe
the same physics.  While the observables that we compute should
reflect these identifications, this does not immediately bear on the
question of whether we count two dual vacua in dual effective
field theories as equivalent or not.  If they do not come from dual
underlying compactifications, they clearly count as distinct possible
vacua in any reasonable theoretical formulation.  Since we already
have weights, there is no difficulty in representing this.

Third, it may be that two choices of the discrete compactification
data are dual and lead to the same set of vacua.  It could
even be that two choices are only partially dual: that there is a
subset of vacua of theory A which are to be identified with a subset
of vacua in theory B, while the other vacua are distinct (or perhaps
identified with other theories).  This leads to problems of description
analogous to the first point above.

All these features lead to complexity in the relation between the starting
point (string/M theory) and the final ensemble, but they need not imply
inherent complexity in either the starting point or the final ensemble.
Nevertheless we need some formal language to describe it.

The suggestion we will make to treat it is the following.  We generalize
our weight $P_n$ which represented the weight of a given configuration
space $\CC$, to a weight function on $\CC$, a real function 
$\rho(\CC;\ z,\bz)$.
And we generalize the definition of the expected number of vacua to
$$
\vev{N_{vac}} = \sum_\CC
 \int [d\mu(K,W)]\ \int_\CC\  \delta^{(2n)}(V')~ |\det V''|~
 \rho(\CC;\ z,\bz) .
$$
This is a rather broad generalization which certainly allows the
freedom to deal with the problems we just discussed.  If we only
trust a given effective field theory to describe a subset of
configuration space, we set $\rho=0$ outside that subset.  If we
have two dual theories which each describe a region $R$, we set
$\rho=\half$ for each of the theories within $R$, and so on.

Obviously this is a highly redundant and ambiguous description, and it
would be implausible to claim that string/M theory leads to particular
preferred $\rho$'s, $\CC$'s, and so forth.  On the other hand, to the
extent that string/M theory leads to many different effective
theories, it is not {\it a priori} implausible to claim that the sum
of the contributions to the ensemble from many unrelated effective
theories produces a much simpler ensemble, with simple choices for
$\rho$ along with the rest of the data, than any of the individual
effective theories might suggest.  Such a claim should be evaluated by
comparing results computed in a given ensemble to results derived
directly from sets of many actual compactifications of string theory,
in a spirit somewhat analogous to the original tests of superstring
duality.

We are not claiming that all physical questions about string/M theory
can be usefully addressed this way.  But to answer some questions,
starting with the number of vacua, and going all the way to our
primary question of how many vacua well approximate the Standard
Model, we do not need to reproduce the stringy ensemble precisely.  To
the extent that string/M theory has finitely many vacua (with
