,ref
(\alpha')^{D/2}$, one finds that $\Lambda_0 V_M^{4/6}$ is small, but
since $J=b_{p+1} \sim 100$ is typical for \CY3's, at first sight this
seems viable.  On the other hand, as will be clear below, the
flux contributions which cancel $-\Lambda_0$ typically lead to
supersymmetry breaking at a scale $\Lambda_0^{1/4}$,\foot{I thank
Shamit Kachru for emphasizing this point.}, and $\Lambda_0 \sim M_{pl}^4$
is not acceptable from this point of view.

In any case, this discussion demonstrates the possibility of large
multiplicities of vacua with cosmological constant uniformly
distributed near zero, and thus a potential solution to this problem
by our rules.  The discussions in \refs{\brown,\bousspol,\feng} attempted to
go further and explain the observed low value as the result of a
natural decay process involving nucleation of domain walls which
source the flux and lower the vacuum energy, down to some minimum
positive value.  They found that this mechanism is difficult to
realize as tunneling rates between flux vacua, even in the best case,
tend to be too small.  We will not insist on this or on the simple 
form \fluxpotential, but only on \cccond, which could be realized by
many types of degeneracy, including those in which the relevant vacua
had wildly different microscopic origins.

\subsec{A finiteness conjecture}

The previous discussion was somewhat simplistic as it ignored the fact
that the moduli of the internal cycles which minimize the true
effective potential in fact depend on the fluxes.  This was
inessential to the main point of \bousspol, but as a next step needs to be
taken into account.

The most obvious question this dependence raises is that the form of
\fluxpotential\ admits the possibility of sequences of vacua in which
both fluxes $N$ and volumes $V_{p+1}$ run off to infinity in a
correlated way, such that the cosmological constant stays finite.  If
so, it would simply not be true that the number of vacua is finite.

In fact the existence of infinite lists of vacua is well-known in
models with more supersymmetry.  The most famous example is perhaps
$S^5$ compactification of the \IIb\ string, which has infinitely many
vacua, parameterized by the number $N$ of quantized units of five-form
flux.  In this case, the radius of $S^5$ is proportional to $N^{1/4}$,
so this family runs off to large volume and small cosmological
constant.  In \trivedi, a similar series of $T^6$ flux compactifications
was found.  These are non-supersymmetric no scale compactifications, but
there seems no reason not to expect similar supersymmetric examples.

According to our rules, this is not a problem if none of these
infinite series of vacua look like the real world, and if volumes
of cycles $V_{p+1}$ run off to infinity, one is certainly tempted to
say that the total volume $V_M$ will as well, and the four
dimensional Planck scale $M_{pl}$ will run off to infinity.

Thus, in the absence of further constraints, the predictivity of
string/M theory depends on the
conjecture that the number of consistent flux vacua with
cosmological constant $|\Lambda| < \Lambda_{max}$, a bound we choose,
and compactification volume $V_M < V^\ub$, a upper bound,
is finite.  In examples (we will discuss one shortly), one also has
constraints on the fluxes from anomaly cancellation, which depend on
other input (numbers of branes and topology of the \CY3); let us
denote this input as $[B]$.

Then, the conjecture is that the total number of vacua, summing over all
allowed values of the flux,
\eqn\fluxconj{
N_{flux\ vac}(\Lambda_{max},V^\ub,[B]) \in \BZ
}
is finite.  We would conjecture this for any type of vacua, but
supersymmetric vacua (AdS and Minkowski together) would be the simplest
case to check.

This conjecture is not proven in any case we know of and might need to
be further refined.  One possible refinement would be to replace the
bound on total volume $V_M$ with bounds more directly related to
observation, because the appropriate bound on $V_M$ is very different
in the traditional dynamical supersymmetry breaking scenarios, and in
the ``large extra dimension'' scenarios.  This would be worth
developing, but in either case physics does place an upper bound
on $V_M$.

{}From what we have said so far, the most obvious way this conjecture 
could fail would be to find a series of models in which $-\Lambda_0$,
the vacuum energy at ``zero flux,'' became arbitrarily negative,
because one expects to be able to add fluxes to compensate it.

\subsec{Exact flux potential in \IIb}

An exact result in the large volume limit of \IIb\ string
compactification can be obtained by writing the potential in terms of
the Gukov-Vafa-Witten superpotential \gvw\ and using the special
geometry results we cited above to compute the periods of the CY.
This superpotential is a function of the CY complex structure moduli
$z^i$ and the axion-dilaton $\tau$.  We will also need to discuss
K\""ahler moduli; let $\rho$ be a K\""ahler modulus.  

We then have
\eqn\gvwii{
W = \int \Omega \wedge (F_{RR}^{(3)} + \tau H_{NS}^{(3)}) ,
}
where $F_{RR}$ and $H_{NS}$ are the Ramond-Ramond and Neveu-Schwarz
three-form field strenghs of \IIb\ string theory.
Using the quantization \fluxquantum, this can also be written
\eqn\gvww{
W_{flux} = \sum_i \Pi_i (N_{RR}^i + \tau N_{NS}^i) ,
}
with $N^i\in\BZ$ and $\Pi_i$ the periods defined above.
At large volume, the K\""ahler potential can be
obtained by KK reduction; it is (in terms of the \CY3 moduli space
K\""ahler potential $K_Z$, as in \tsixK)
\eqn\Krho{
K_{\tau,\rho} = K_Z - \log \Im \tau - 3 \log \Im \rho .
}
Using $K$ and $W$ in the standard $\CN=1$ supergravity
expression \sgpotential, one obtains the flux effective potential 
$V_{flux\ 2}$.

One cannot choose arbitrary fluxes; there is a constraint from
anomaly cancellation.  This will only work for \IIb\ orientifolds, 
for the simplest case of $O3$ planes it requires a tadpole
cancellation condition of the form \gkp %
\eqn\anomalyflux{
{1\over (2\pi)^4\alpha'^2}
 \int H_{NS}^{(3)} \wedge F_{RR}^{(3)}
= \vev{N_{NS},N_{RR}} = K - N_{D3}
}
where $\vev{N_{RR},N_{NS}}$ is the intersection form, $K$ is a positive
integer (the orientifold tadpole) and $N_{D3}$ the number of 
space-filling D3 branes (which must be nonnegative for supersymmetry).
Furthermore, one can show \refs{\gvw,\kst}\ that $\CN=1$ supersymmetry
implies that this number is non-negative.  This combination of facts 
gives a bound valid for supersymmetric vacua,
$$
0 \le \vev{N_{NS},N_{RR}} \le K .
$$
One might think that this provides an {\it a priori} bound on the
total flux, which would be very helpful in proving that the
number of vacua is finite.  This bound may be necessary, but
as we discussed above, we believe one needs to place
additional conditions on the flux vacua to get a finite number.
In particular, the form which appears in this bound is an
indefinite form (as is any bilinear form in two independent vectors),
so an infinite number of choices of flux satisfy this bound.  

The formula \gvww\ in itself is rather abstract; one needs to know
something about the behavior of \CY3 periods $\Pi^i$ to have any
intuition for it.  The basic local example is the behavior near a
conifold point, at which a conjugate pair of periods behaves as
$$
\Pi_A = z; \qquad \Pi_B = {\rm const} + {1\over 2\pi i} z \log z + \ldots .
$$
The corresponding flux superpotential is dual to the
$\CN=1$ SYM instanton superpotential \vafadual\ (we discuss this further
below); in this context it was studied in \gkp.
To get some global picture, one can consider the $T^6$ example, 
for which the periods are simply polynomial
in the complex structure $Z_{ij}$, already displays a lot of
structure, and we recommend that the reader unfamiliar with \CY3
look at \refs{\kst,\trivedi} as a start.

Let us pause to make some trivial mathematical remarks, which we find
important to get the right intuition about the configuration space
$\CC$ and this superpotential, which is rather different from what
intuitions based on branes or gauge theory on a compact space would
suggest.  What we have to say can be summarized mathematically as
follows: \CY3 complex structure moduli space, and (we conjecture) the
``true'' configuration space $\CC$ with stringy and quantum
corrections taken into account, is a hyperbolic space \kobayashi.

To illustrate what this means, we consider the simplest
``Calabi-Yau,'' the elliptic curve $T^2$ (equivalently, we could
discuss the dilaton-axion dependence in the \IIb\ problem).  Let its
complex structure is $\tau$, then its periods are $m + n\tau$ for
$m,n\in\BZ$.  They are not single-valued on the moduli space of
complex structures, which is the fundamental region in the upper half
plane, and thus the flux superpotential is not single-valued on moduli
space either.  

Rather, the periods are single valued on the Teichm\""uller space (by
definition), the upper half plane $\Im\tau>0$.  This is an open
complex manifold which (for purposes of studying these periods) cannot
be compactified.  Physically, this is to say that since a non-zero flux
breaks $SL(2,\BZ)$, there is no longer a unique large complex structure
limit, but rather many such limits.

In this situation, the ``topological'' counting formulas we discussed
earlier are not literally topological; by varying $W$ one can move
critical points $DW=0$ from the upper to the lower half plane.  Thus,
there is no immediate estimate of the form ``$N_{vac}=\chi(\CC)$'' for
numbers of flux vacua.  Related to this, a given period can take
values in a subset of $\BC$, and this is a possible behavior for a
superpotential on $\CC$.  All this is known for $T^{2n}$ and to some
extent for \CY3 moduli spaces, and we suspect it is the general
picture.

Returning to more local considerations, for generic fluxes, \gvww\
leads to a sufficiently complicated potential to make it very
plausible that critical points are isolated in all the variables it
depends on, the complex structure and axion-dilaton.  Although one
might worry that these critical points might be unstable to run away
to weak coupling (large $\Im \tau$) or large volume $\Im Z$, for
supersymmetric vacua this is not possible, as they necessarily have
$\Lambda\le 0$, while these limits have $\Lambda\rightarrow 0$.

Supersymmetric Minkowski vacua have been shown to exist; their
physical properties are discussed in \refs{\kst,\trivedi} and
many other works.
However, as it stands, this effective potential has no supersymmetric AdS
minima.  This is because $\p W/\p \rho=0$ and the special form of \Krho,
which forces
$$
g^{\rho\bar\rho} D_\rho W D_{\bar\rho} W^* = 3|W|^2
$$
and thus $V_{flux 2}\ge 0$, with equality if $D_i W=0$ in the
other moduli.  Since $D_i W=0$ is as many equations as unknowns, it
will have solutions; indeed this is just the problem of counting
critical points where we forget about the K\""ahler moduli.

This form for the potential is called ``no-scale structure''  and follows
because this is just another way to write
\fluxpotential, with its proper dependence on moduli
computed via KK reduction, and \fluxpotential\ is a positive sum of
squares.  The independence of $W$ on $\rho$ (which is exact in
perturbation theory) also implies that this potential does not
stabilize the overall volume (with more K\""ahler moduli, typically
some but not all are stabilized).

\subsec{Violation of no-scale structure, and the origin of $\Lambda_0$}

No-scale structure is a feature of the large volume, weak coupling
limit.  In any real model, further corrections will spoil this
structure and stabilize the K\""ahler modulus.  In fact, a ``no scale''
nonsupersymmetric vacuum with $V=0$, if it exists in the real theory,
will actually be a supersymmetric AdS vacuum.

Arguments have been made for explicit $\rho$-dependent corrections both
to $K$ and to $W$.  In \beckers, $\alpha'^4$ corrections to the 
ten-dimensional \IIb\ supergravity action were shown to produce the
following correction to \Krho,
$$
\delta K_{\tau,\rho} = {e^{-3\Im\tau/2}\over(\Im\rho)^3} + \ldots
$$
In \linde, it was recalled that 
nonperturbative effects in a $U(N_c)$ 
gauge theory sector will generically lead to exponentially
small corrections
\eqn\expW{
\delta W = M^3 e^{2\pi i\rho/N_c} + \ldots,
}
and there are stringy nonperturbative corrections of this form as well.

Either or both corrections spoil the no-scale structure.  A similar
correction spoiling no-scale structure can be found in $G_2$
compactification, by turning on a gauge field on an ADE singularity
supported on a hyperbolic 3-manifold, leading to stable AdS minima
\achflux.  In \linde\ it was shown that the correction \expW\ will
also lead to stable AdS minima, and that further effects can lift this
to a dS minimum, in a controlled regime (weak coupling and moderately
large volume).  

We regard these results as valuable evidence for our basic assumption,
that effective field theory can describe the physics of string/M
theory vacua.  However, we will have to make different arguments
to claim that this stabilization works at arbitrary coupling and
volume.

In the exact theory, one expects the K\""ahler moduli to be stabilized,
simply because of genericity.  In fact, the real problem is that they
are overdetermined; not only do we expect superpotential dependence as
in \expW, but if we had gone more deeply into the D-flatness
conditions in the brane sector, we would have seen that these already
stabilize one (real) K\""ahler modulus for each homology class of
simple brane in the construction (this type of argument can be found
at the end of \aspdoug), and a real treatment of this problem must bring
in the D-flatness conditions.  

However, to get some idea of the possibilities, let us simply assume
that nonperturbative physics produces a
superpotential which is the sum of \gvww\ and a correction
depending only on $\rho$,
\eqn\simplecor{
W = W_{flux} + f(\rho) ,
}
We retain \Krho\ for the K\""ahler potential.  This choice was made
because small corrections to $W$ can easily change the problem
qualitatively (by changing the $W=0$ locus), while small corrections
to $K$ generally do not.

In this case, the supersymmetry conditions for the complex structure
moduli and axion-dilaton are unaffected, while the $D_\rho$ condition 
becomes
\eqn\solverho{
0 = D_\rho W = D_\rho f(\rho) - {3\over\Im\rho} W_{flux}(Z,\tau) .
}
This equation determines $\rho$ in terms of $W_{flux}$ at a
critical point.  The resulting vacuum energy is
\eqn\newvac{
V = - 3 e^K |W_{flux} + f(\rho)|^2 ,
}
again implicitly a function of $W_{flux}$.

Now, the problem of finding critical points of $W_{flux}$ does not
have any obvious preferred scale, and it seems likely that by varying
the fluxes one can find critical points with arbitrarily large
magnitude $|W_{flux}|$, even taking into account the
anomaly cancellation condition \anomalyflux\ (since this is an
indefinite form).
In light of \newvac, this potentially violates our finiteness
conjecture.  There are two ways it could be saved, either by
cancellations in \newvac\ or by the possibility that if
$|W_{flux}|$ exceeds some upper bound $W_{max}$, the equation
\solverho\ will fail to have solutions.  The first possibility
requires an implausible conspiracy between $W_{flux}$ and $f(\rho)$,
so we consider the second.
This solution to the problem simply requires that the function
\eqn\fbound{
(\Im\rho) D_\rho f(\rho)
}
have an upper bound, which will be $W_{max}$.  This requires $f(\rho)$
to fall off as $\Im\rho\rightarrow\infty$, but we already know this
is true.  Requiring boundedness elsewhere more or less amounts to
requiring that $|f(\rho)|$ itself is bounded.  As we discussed, this
is quite possible; indeed the function \expW\ on the upper half plane
is an example.

It seems to us that some structure of this type is required to get
the number of flux vacua to be finite.  If we grant the simple
form of the equations \solverho, then we would conclude that the most
useful way to count supersymmetric flux vacua is to impose a bound
\eqn\Wbound{
e^K |W_{flux}|^2 < |W_{max}|^2
}
for some $W_{max}$, probably depending on the particular \CY3 and
other features of the compactification, and that the number so
defined should be finite. 

This would then lead to a lower bound on $\Lambda_0$, which in this
language unfortunately depends on nonperturbative physics.  It
might be that the origin of $\Lambda_0$ and any bounds it must satisfy
would be clearer in some dual picture.  Anyways, we offer this as
an argument for stabilization which could hold in general.

Unlike our other such arguments, the upshot of this one was not that
we claim K\""ahler moduli are stabilized for an $O(1)$ fraction of the
flux vacua.  Rather, we needed to call upon properties of some
(assumed) K\""ahler stabilization to even formulate the question of
counting flux vacua.  The formulation we end up with is the one given
in \fluxconj.

\subsec{The cross-coupling problem}

The flux potential is rather complicated but at least explicit, so we
can answer some interesting questions with it.  One of these is
whether in different vacua which might superficially agree with the
Standard Model, and have acceptably small cosmological constant, the
couplings are equal or at least similar, or whether they vary wildly
upon varying the fluxes.  On general grounds, Banks, Dine and Motl
\bdm\ suggested that the latter would be true, and more recently
this has also been pointed out by Acharya \acharyanew.

For example, let us consider a class of models which all contain a
common subsector of the model in which the Standard Model degrees of
freedom live.  For example, one can propose a configuration of branes
wrapped on cycles which realize the Standard Model matter content, and
which might be embedded in many different \CY3's.  This idea is
sometimes called ``modularity'' and is certainly natural from an
engineering point of view.  However, the question we come to is how
much of the structure of the rest of the
\CY3 we need to know about to predict any couplings.

We model the
situation by proposing two ``sectors,'' the ``Standard Model''
and everything else.  We have Standard Model fields $\psi$,
fields $Z$ which directly
control Standard Model couplings, and many more fields $y$ which
do not.  We then postulate a superpotential of the form
$$
W = \sum N_i \Pi^i(y,z) + W_{SM}(z,\psi)
$$
Suppose we vary the fluxes $N_i$ by an allowed quantized amount 
$\Delta N$ and find a new minimum; how much
do we expect the Standard Model couplings to change?  To simplify
the problem, we consider an infinitesminal variation $\delta N$;
although this is not physical, if $W$ and $K$ are not too rapidly
varying (which is generically true) $dZ/dN \Delta N$ will be
approximately the same.

One's first picture is that some $N_\alpha$ are associated to the ``cycles''
which we use to build the Standard Model, while most are not, and that
varying the $N_i$ which are not will make tiny corrections to the
$Z$'s.  This can be made more precise by computing $\p Z^i/\p N^j$
along the minima $W'=0$.  The only general topological relation between
cycles is expressed in the intersection form, $\eta_{ij}$.  Thus,
the type of general decoupling one might have expected would be true
if
$$
{\p Z^i \over \p N^j} \sim A_{ij} \delta_{ij} + B_{ij} \eta_{ij}
 + {\rm small\ corrections} .
$$

What actually happens if we vary satisfying $\delta (N^j D_k W_j) = 0$, is
that $\delta z$ determined by
$$
\delta N^j D_k W_j + N^j \delta z^i D_k \p_i W = 0
$$
can be large if $DW$ is large (in the other flux directions) or
$D^2W$ is small.  Now $D_k W_j \sim \tau_{kj}$ the matrix of 
$U(1)$ couplings.  At general points in moduli space,
these will not line up with $\delta_{ij}$.

This ``cross-coupling'' makes it difficult to claim that quantitative
aspects of one sector of the theory, such as couplings, can be
independent from quantitative aspects of another.
This is potentially another severe problem for the predictability of
the theory, and cannot be ignored.  However, it is not clear how much
of a problem it is, without having some real numbers.




\subsec{Brane-flux duality}

So far we discussed brane and flux degrees of freedom separately, but
it is known that this is overcounting, as many configurations have
dual descriptions of both types.  The prototype for this is of course
the seminal work of Maldacena \malda, which has been reinterpreted and
generalized in many ways.  For the purposes of string
compactification, perhaps the most useful form of this duality is the
``geometric duality'' of Gopakumar and Vafa \gv.

The simplest version of this states that a theory of $N$ D5-branes
wrapped on a small $S^2$ in a \CY3, which leads to $\CN=1$ $U(N)$
super Yang-Mills theory and a quantum generated superpotential, is
equivalent in a configuration with flux $N$ on a related \CY3 obtained
by replacing the $S^2$ with an $S^3$ (the ``conifold transition'').
This was proved (in a sense) in \ov, and many generalizations of the
basic result are known to more complicated geometries.

The full extent of brane-flux dualities is not known and we will have
to make a plausible guess to deal with this.  The most naive guess
would be that all branes can be dualized to flux, but this is not
possible as flux theories cannot have low energy non-abelian gauge
symmetry, while supersymmetric gauge theories with sufficient matter
(for example, $U(N_c)$ theory with $N_f>N_c$ flavors of matter) can.
It is amusing that the supersymmetric Standard Model provides 
an example, though because supersymmetry must be broken at a higher
scale than the strong coupling gauge scale it is not guaranteed that
this has deep significance.  In any case, we cannot realize the
Standard Model purely within the \IIb\ closed string sector.

A more sensible claim would be that brane theories which generate
superpotentials at the quantum level (for example, $U(N_c)$ SYM with
$N_f<N_c$ flavors of fundamental matter) can be dualized, while others
can not.  If so, then large numbers of brane configurations on \CY3's
are in fact redundant descriptions of the flux vacua, and should not
be counted.

A test of this idea, would be to compare the numbers of supersymmetric
vacua in a brane configuration on \CY3 $X$, with the number of flux
vacua in the geometric dual $Y$.  Since there are so many more brane
configurations than \CY3's, it is quite likely that many gauge theories
are in fact dual to the same \CY3 with fluxes, presumably to different
vacua within the latter theory.  Some field theory counterparts of this
possibility have been observed in \csw.  Given such an identification,
reproducing the same counting of vacua on both sides would be impressive
evidence for the duality.

The minimal test of this is that the number of flux vacua in the dual
theory should have $c^N$ multiplicity (in the new sector) as we argued
was generic for gauge theory.  Now the dual of a theory with $N$
distinct types of (B type) brane is a \CY3 with $2N$ new classes in
$H_3(Y,\BZ)$.  We have given arguments and will give more below that
this is the form we expect for multiplicities of flux vacua.

\subsec{To be continued}

At this point we have introduced more or less all the the ingredients
we will use to ``count vacua'' in section 5.  Although we somewhat
oversimplified them, we cannot do much better without a better
understanding of the many open issues we mentioned (and no doubt those
we didn't mention).  Furthermore, our picture has been too sketchy on
points such as orientifolding and anomaly cancellation, and has simply
left out a great deal, such as $E_8$ gauge symmetry (not visible at
weak coupling in \IIb) and other nonperturbative light states, the
brane world-volume superpotential, the detailed structure of stringy
nonperturbative effects, and so on.

Nevertheless, let us conclude with a final summary of how we will
combine the choices we just discussed in section 5.  Of course on a basic
level one picks a \CY3, a brane and flux configuration and so on; but to what
extent do these choices correspond to the more precise definitions of
vacuum counting we gave in subsection 3.2 ?

In $\CN=1$ \IIb\ theory, the chiral
multiplets can be divided into the complex moduli $Z$, the
dilaton-axion $\tau$, the K\""ahler moduli $\rho$, and the open string
modes $\psi$.  Techniques exist for computing classical brane
world-volume theories, with a superpotential $W_{cl}(\psi,Z)$ and
gauge couplings depending on $\rho$.  The D-flatness conditions
contain FI terms which also depend on $\rho$.  In fact many $U(1)$'s
are anomalous and these couplings are partners to the anomaly cancelling
couplings, lifting some of the $\rho$'s.

In general, we can expect gauge theory sectors with small matter
content (so, not including the Standard Model sector) to generate a
quantum superpotential stabilizing all their fields $\psi$.  On the
other hand, preserving supersymmetry in the Standard Model and other
sectors with large amounts of matter will tend to fix the moduli $\rho$
controlling their brane tensions (so that the different branes preserve
the same $\CN=1$ supersymmetry).

The simplest description of this physics would be to employ our conjectural
brane-flux duality to turn all of the branes for which quantum effects
lift the moduli space, into fluxes.  Thus, we will count brane configurations
with moduli spaces, multiplied by flux configurations, on each relevant
\CY3, and justify this by appealing to \sgindexprod.

Unfortunately, we are not keeping enough information in our considerations
to decide which brane theories have quantum moduli spaces; this depends
on the superpotential.  We will simplistically assume that all of the
hidden sector theories can have sufficiently complicated superpotentials
to produce isolated vacua and make this duality appropriate.  
Although this is clearly not always true (for example if we realized
