,ref
0,"\refs{\distler,\distgreene} --- for which
{\it each} world-sheet instanton simply cannot contribute to $W$.

In this light, the result of \silver\ that there are no non-perturbative
contributions to $W$ that destabilize compactifications described by
$(0,2)$ linear sigma models \refs{\phases, \distnotes} is somewhat
surprising.  This result does not rely upon any consideration of
world-sheet instantons and instead follows from simple facts about
the linear sigma model.  One simply observes that $W$ must always be a
holomorphic section of a complex line-bundle of strictly negative
curvature over the moduli space of the low-energy effective theory,
which is naturally a compact K\""ahler manifold in the case of a linear
sigma model.  The compactness of the moduli space implies that
$W$ must have a pole somewhere on the moduli space or else vanish
identically.  However, the linear sigma model, being a two-dimensional,
super-renormalizable gauge theory, can only become singular when the
target space becomes non-compact, as some bosonic field develops a
dangerous, unsuppressed zero-mode.  In computing the linear sigma
model correlators which describe the couplings of gauge-singlet fields
in the effective theory and so probe for a background $W$, one finds
that, after suitably twisting the model, no boson has a dangerous
zero-mode.  So $W$ has no poles on the moduli space and thus vanishes.

Now, Calabi-Yau compactifications which are described by $(0,2)$
linear sigma models are certainly not generic --- but nor are they so
special that each world-sheet instanton simply does not contribute to
$W$.  So from the world-sheet perspective, the stability of $(0,2)$
linear sigma models implies in these compactifications a remarkable
cancellation among the contributions to $W$ from world-sheet
instantons wrapped on rational curves in each homology class of $X$.

For instance, the analysis of \silver\ was applied in most detail to
the simple case that $X$ is a quintic hypersurface in $\BC \BP^4$
and $E$ is a deformation of the holomorphic tangent bundle $TX$,
corresponding to a deformation off the locus of $(2,2)$ supersymmetric
world-sheet theories.  In this case, the linear sigma model result
implies that, contrary to one's naive expectation, the world-sheet
instanton contributions to $W$ from the $2 875$ lines on the generic
quintic sum to zero.

Our main goal in this paper is to understand, from the world-sheet
perspective, the source of this remarkable cancellation among
instantons.  In the process, we will introduce a new $(0,2)$ ``half-linear''
sigma model and show that heterotic compactifications
described by these models form another class of stable $\CN=1$ string
backgrounds.  For instance, using the half-linear model we show that
heterotic compactifications on the quintic hypersurface in $\BC \BP^4$ for
which the gauge bundle pulls back from a bundle on $\BC \BP^4$ are stable.

More generally, just as for the linear models, the half-linear
models can be used to describe compactification on any Calabi-Yau
threefold $X$ which is a complete-intersection in a compact toric
variety $Y$.  However, in the half-linear models the bundle $E$ on
$X$ is now any stable, holomorphic bundle which pulls back from a
bundle on $Y$.  In particular, $E$ need not be a ``monad'' bundle
on $X$, the sort\foot{Technically, a monad bundle is one which
admits a description as the cohomology of a complex $A \rightarrow
B \rightarrow C$ of three bundles $A$, $B$, and $C$ on $X$.} most
naturally described in the linear sigma model.  Conversely,
however, there are also monad bundles on $X$ (including obvious
ones such as its tangent bundle) that do not pull back (at least
in any obvious way) from a holomorphic bundle on $Y$.  So we will
also develop a version of the vanishing argument adapted to linear
models and monad bundles on $X$.

\subsec{A Brief Sketch of the Idea}

Our essential idea can be motivated by considering the actual form
of the instanton contributions to $W$ in the simple case that the
string world-sheet wraps once about an isolated rational curve $C$ embedded
in $X$.  Actually, the most direct and elegant way \refs{\bbs, \dinst}
in this case to derive the instanton contribution to $W$ is to evaluate the
partition function of the worldvolume theory on a single $D1$-brane
wrapped on $C$ in the Type I theory, which is the dual description
\hettypei\ of a world-sheet instanton in the $Spin(32)/\BZ_2$
heterotic theory\foot{As explained in \dinst, the derivation of $W$
from the Type I theory most directly applies to the $Spin(32)/\BZ_2$
heterotic theory, but holomorphy and gauge-invariance allow us to
interpret the answer for the $E_8 \! \times \! E_8$ heterotic theory
as well.}.  Holomorphy allows us to evaluate this partition function
at one-loop, so the instanton contribution to $W$ from $C$ is just
\eqn\wcinst{
W(C) = \exp{\left( -{{A(C)} \over {2 \pi \alpha'}} + i \int_C B
\right)} \, {{{\hbox{Pfaff}'(\CD_F)}} \over {\sqrt{\det'(\CD_B)}}}
\,.}

Here the exponential factor in $W(C)$ represents the classical action
of the $D1$-brane.  We have written this action in heterotic units,
so that $A(C)$ is the area of $C$ in the heterotic string metric on $X$,
$\alpha'$ is the heterotic string tension, and $B$ is the heterotic
$B$-field.

The other factor in $W(C)$ arises from the one-loop
integral over the fluctuations of the bosons and fermions living on
the worldvolume of the $D1$-brane.  $\CD_B$ and $\CD_F$ are thus the
respective kinetic operators of the worldvolume bosons and fermions,
and the ``prime'' in $\det'(\CD_B)$ and $\hbox{Pfaff}'(\CD_F)$
indicates that these expressions are to be evaluated only after
omitting the zero-modes associated to the bulk symmetries which are
broken by the $D1$-brane.  Four bosonic zero-modes associated to the
broken translational symmetries in $\BR^4$ and two right-moving
fermionic zero-modes associated to the broken supersymmetries arise in
this fashion.

The complex structure moduli of $X$ and $E$ are described by chiral
superfields in the low-energy, effective $\CN=1$ theory, and $W(C)$
must depend holomorphically on these fields.  Unfortunately, our
simple expression \wcinst\ for $W(C)$ is not manifestly holomorphic.
To get a manifestly holomorphic expression for $W(C)$, we must use
the fact that the two supersymmetries left unbroken by the $D1$-brane
imply a cancellation between the contributions of the right-moving
fermionic modes to $\hbox{Pfaff}'(\CD_F)$ and the contributions of the
right-moving bosonic modes to $\det'(\CD_B)$.

To make this cancellation explicit, we write $W(C)$ solely
in terms of the left-moving bosonic and fermionic modes.  By convention,
the kinetic operator of a left-moving fermion on $C$ will be a $\overline
\partial$ operator, while the kinetic operator for a right-moving
fermion will be a $\partial$ operator.  Thus, since the left-moving
worldvolume fermions transform as sections of the left-moving
spin bundle\foot{Here $\CO(n)$ is the usual notation for
the complex line-bundle of degree $n$ on projective space.  In
particular, $\CO$ is the trivial complex bundle of rank one.}
$S_- = \CO(-1)$ on $C$ tensored with the gauge bundle $E$ as
restricted to $C$, their contribution to $\hbox{Pfaff}'(\CD_F)$ is
just the Pfaffian of the $\overline \partial$ operator coupled to
$E \otimes \CO(-1) \equiv E(-1)$, which we denote
$\overline \partial_{E(-1)}$.

Similarly, in the formula \wcinst\ for $W(C)$, we have written the boson
kinetic operator $\CD_B$ as a real operator acting on the eight real
bosons representing the normal directions to $C$ in $\BR^4 \times X$.
Since $C$, $X$, and $\BR^4$ all have complex structures, we can
equally well group the eight real bosons into four complex bosons
taking values in the complex normal bundle $N$ to $C$ in $\BR^4
\times X$.  When $C$ is isolated in $X$, $N$ is isomorphic to $\CO
\oplus \CO \oplus \CO(-1) \oplus \CO(-1)$, the first two summands
representing the normal directions in $\BR^4$ and the last two summands
representing the normal directions in $X$.  Thus, the contribution of
the non-zero left-moving bosonic modes to $\det'(\CD_B)$ just
arises from the $\overline \partial$ operator on $C$ coupled
to the normal bundle $N$.

So, cancelling out the right-moving modes from $W(C)$ in \wcinst, we
have
\eqn\holwcinst{
W(C) = \exp{\left( -{{A(C)} \over {2 \pi \alpha'}} + i \int_C
B \right)} \, {{\hbox{Pfaff}\left(\overline \partial_{E(-1)}(C)\right)} \over
{\left(\det'{\overline \partial_\CO}\right)^2 \left(\det{\overline
\partial_{\CO(-1)}(C)}\right)^2}} \,.}
This expression for $W(C)$ is now manifestly holomorphic.  Specifying
a $\overline \partial$ operator on either $X$ or $E$ is equivalent to
specifying its complex structure, so the operators
$\overline \partial_{E(-1)}(C)$ and $\overline \partial_{\CO(-1)}(C)$
themselves depend holomorphically on the complex structure moduli of
$X$ and $E$.  We have also emphasized in \holwcinst\ that the way in
which the complex structure moduli of $X$ and $E$ appear in these
$\overline \partial$ operators itself depends upon which curve $C$ in
$X$ that the instanton wraps.  In fact, at least when $X$ is
elliptically fibered, one can derive very explicit expressions in
given examples for the dependence of $W(C)$ on the moduli of $E$ and
$X$ \refs{\pennI, \pennII}, although we will not be needing such
detailed expressions here.

Thus, in the case that $X$ is a generic quintic in $\BC \BP^4$ and $E$
is a deformation of $TX$, the vanishing of $W$ implies as a corollary
that, summing $W(C)$ over the $2875$ lines on $X$,
\eqn\corollary{
\sum_{i=1}^{2875} \; {{\exp{\Big( i \int_{C_i} \! B \Big)} \;
\hbox{Pfaff}\left(\overline \partial_{E(-1)}(C_i)\right)} \over
{\left(\det{\overline \partial_{\CO(-1)}(C_i)}\right)^2}} = 0\,.}
In this expression, we have dropped from $W(C)$ an overall factor of
$\exp{\Big({{-A(C)} \over {2 \pi \alpha'}}\Big)}$, which is constant for
curves on $X$ of given degree, and a factor of $(\det'{\overline
\partial_\CO})^{-2}$, which is simply constant.

One is very much also tempted to drop from \corollary\ the factor
of $\exp{(i \int_{C_i} \! B)}$, which is at least ``morally'' constant
on curves of given degree.  However, as reviewed in \dinst, because
only the product of $\exp{(i \int_{C_i} \! B)}$ and the fermion
Pfaffian is even well-defined, we must technically include in
\corollary\ this factor involving $B$ so that the full expression
makes sense.  Nevertheless, our interest in \corollary\ resides in the
holomorphic dependence of this formula on the complex structure moduli
of $X$ and $E$, and we will not dwell here on the subtleties of the
heterotic $B$-field.

At first sight, the formula \corollary\ might seem like an exotic
mathematical prediction derived only indirectly from the underlying
$(0,2)$ linear sigma model.  But in fact, this sort of formula has a
clear precedent from algebraic geometry, in the form of a residue
theorem.

To derive the simplest example of such a residue theorem, suppose that
$\omega$ is a meromorphic one-form on $\BC \BP^1$ with simple poles
at points $P_i$, $i=1,\ldots,N$.  Letting $z$ be a holomorphic coordinate
on $\BC \BP^1$, we can express $\omega$ as
\eqn\form{
\omega = {{g(z) dz} \over {f(z)}}\,,}
where $f$ and $g$ are polynomials in $z$, $f$ having non-degenerate
zeroes at the points $P_1, \ldots, P_N$.  Without loss, we assume
that $\omega$ does not have a pole at $z = \infty$, so that the degrees of
$f$ and $g$ satisfy
\eqn\degs{ \deg{g} \le \deg{f} - 2\,.}

As usual, we then define the residue of $\omega$ at each point $P_i$, denoted
$\hbox{Res}_{P_i}(\omega)$, by integrating $\omega$ over a small
contour $\gamma_i$ about the point $P_i$,
\eqn\onedres{
\hbox{Res}_{P_i}(\omega) = {1 \over {2 \pi i}} \, \oint_{\gamma_i}
\omega \,= {{g(P_i)} \over {\partial f / \partial z (P_i)}} \,.}
We now obtain a residue theorem simply by considering the sum of contours
\eqn\bigg{ \Gamma = \gamma_1 + \cdots + \gamma_N\,.}
Since $\Gamma$ is contractible, we have
\eqn\resthm{
0 = {1 \over {2 \pi i}} \, \oint_\Gamma \omega = \sum_{i=1}^N
\hbox{Res}_{P_i}(\omega) = \sum_{i=1}^N {{g(P_i)} \over {\partial f /
\partial z (P_i)}} \,.}
So the residue theorem simply states that the sum of the residues of
$\omega$ is zero.

Comparing \corollary\ to \resthm, we can already see a vague
similarity between these two formulae, with the Pfaffian in
\corollary\ being a holomorphic function analogous to $g$ in \resthm,
and the bosonic determinant in \corollary\ being analogous to
$\partial f / \partial z$ in \resthm.  Our main goal in this paper is
to make the correspondence between these formulae precise, showing
directly that the instanton contributions to $W$ vanish in
suitable models due to an infinite-dimensional generalization
of the simple one-dimensional residue theorem above.

\subsec{The Plan of the Paper}

Our plan for the paper is as follows.  In Section 2, we start by
generalizing the one-dimensional residue theorem to finitely many
dimensions.  Although standard mathematical approaches exist for
studying multi-dimensional residues, as for instance in \refs{\gh, \tsikh},
we will take a more physical approach by studying a certain
supersymmetric, finite-dimensional integral.  This integral is a
natural abstraction of the path-integral over the right-moving
world-sheet fields on the heterotic string, and from it we easily
prove a very general, multi-dimensional residue theorem.

At the end of Section 2, we also describe precisely how the partition
function of the worldvolume theory on a supersymmetric
$D1$-brane can be interpreted as a residue.  Unfortunately, although
the $D1$-brane formalism provides a very elegant description of the
superpotential contribution from any single instanton, the world-sheet
description of the heterotic string turns out to be better for proving
vanishing results for the sums of these instanton contributions.

So in Section 3, we apply our analysis from Section 2 to the
heterotic world-sheet theory itself.  This analysis most directly
generalizes to the ``half-linear'' class of heterotic
compactifications, for which $X$ is a complete-intersection in a
compact toric variety $Y$ and the gauge bundle $E$ on $X$ pulls
back from a bundle on $Y$.  For these compactifications, the
vanishing of the instanton contributions to $W$ follows from
essentially the same argument as we use in Section 2 to deduce the
multi-dimensional residue theorems.  We also show how this
argument can be applied to the $(0,2)$ linear sigma models to
prove directly formulae such as \corollary.

Very recently, Basu and Sethi \basu\ have also given another
argument for the stability of $(0,2)$ linear sigma models.  Their
argument focuses on showing the absence of corrections to the
world-sheet superpotential.

Finally, in Section 4 we consider the $\CN=1$ compactification of
M-theory on a manifold $X$ of $G_2$ holonomy.  Using ideas very similar to
those in Sections 2 and 3, we extend the results of \hm\ by computing
the superpotential contribution from membranes which wrap a continuous
family of supersymmetric three-cycles in $X$.

\newsec{Residues and Supersymmetry}

Rather than trying to generalize immediately from the
one-dimensional residue theorem to an infinite-dimensional residue
theorem which is applicable to the heterotic string, we will warm
up with the simpler generalization to residue theorems in only a
finite number of dimensions.  Our strategy is to consider a
finite-dimensional, supersymmetric integral on an arbitrary
compact, complex manifold $M$. The finite-dimensional residue
theorem then follows from the supersymmetry, which allows us to
localize the integral to a sum of terms generalizing the
one-dimensional residues, and from the compactness of $M$, which
leads to the vanishing of the integral and hence the sum.  After
we obtain this result, we will indicate some easy generalizations
of it which also have relevance to the heterotic models we
introduce in Section 3.  Finally, we describe precisely how the
partition function of the worldvolume theory on supersymmetric
$D1$-brane can be interpreted as a residue.

Standard mathematical approaches to multi-dimensional residues and
residue theorems can be found in \gh\ and \tsikh.  Mathematical
discussions somewhat more related to our approach via supersymmetry
are given in \carliebI, \carliebII, and \liu.

\subsec{A Finite-Dimensional Integral}

We now introduce the finite-dimensional, supersymmetric integral that
is central to our study of residues and which serves as a model for
the path-integral over the world-sheet fields of the heterotic
string.  Since the supersymmetry in our integral is essential, we will
begin by specifying how it acts on the variables of integration.

As mentioned above, we perform the integral over a compact, complex
manifold $M$, having (complex) dimension $n$.  So the bosonic
variables of integration will be the local holomorphic and
anti-holomorphic coordinates $z^i$ and $z^{\bar i} \equiv
\overline{z^i}$ on $M$.

We also introduce a set of anti-commuting, fermionic coordinates
$\theta^{\bar i}$ and $\chi^\alpha$.  Here the fermions $\theta^{\bar
i}$ transform as coordinates on the anti-holomorphic tangent bundle
$\overline{TM}$, and the fermions $\chi^\alpha$ transform as
coordinates on a holomorphic vector bundle $V$, of rank $r$, over
$M$.  The bundle $V$ is completely arbitrary and should be
considered, like $M$, as part of the defining data for our integral.

Besides specifying $V$ itself, we must now also choose a global
holomorphic section $s$ of $V$.  We need this section $s$ simply to
define an interesting supersymmetry transformation for the fermions
$\chi^\alpha$, since none of the other variables of integration
have anything to do with $V$.  So under the supersymmetry $\delta$,
the bosonic and fermionic variables transform as
\eqn\littleQ{\matrix{
&\eqalign{
&\delta z^i = 0\,,\cr
&\delta \chi^\alpha = s^\alpha \,,\cr}
&\eqalign{
&\delta z^{\bar i} = \theta^{\bar i} \,,\cr
&\delta \theta^{\bar i} = 0 \,.\cr}\cr}}
Note that since $s$ is holomorphic, $\delta^2 = 0$, the most important
property of $\delta$.

The supersymmetric integral which we consider takes the general form
\eqn\bigz{
Z = \int_M g \, d \mu \, \exp{(-t \, S)} \,,}
where $t$ is a positive real parameter representing the
``coupling constant'' for $Z$, $S$ is a finite-dimensional ``action''
which we will soon present, and
\eqn\meas{ g \, d \mu \equiv g(z) \, d^n z \, d^n \overline z \,
d^n \theta \, d^r \chi }
is the measure.  Locally, $g$ is a function which represents the
particular choice of measure for $Z$, and to ensure that the measure
respects the supersymmetry, $g$ must be holomorphic.

The fact that we have to worry about the measure for $Z$ may
seem slightly odd, since in many supersymmetric integrals, one can
make a canonical choice of measure (up to normalization).  The
point is that, under any change of variables, the resulting Jacobians
for the bosonic variables are cancelled by the fermionic Jacobians for
their superpartners.

In the case of $d \mu$ above, such a cancellation occurs
between the anti-holomorphic bosons $z^{\bar i}$ and their
superpartners $\theta^{\bar i}$.  So the factor $d^n \overline z \,
d^n \theta$ appearing in $d \mu$ indeed represents a canonical choice
of measure for these variables.

On the other hand, the bosonic variables $z^i$ and the fermionic
variables $\chi^\alpha$ are unrelated by supersymmetry, which
means that we really must choose the factor $g(z) \, d^n z \, d^r
\chi$ appearing in \meas.  Globally, $g$ is not a function but
transforms as a holomorphic section of the line-bundle $\Omega^n_M
\otimes \wedge^r V$ on $M$, where $\Omega^n_M$ denotes as usual
the canonical bundle of holomorphic $n$-forms on $M$ and $\wedge^r
V$ is the top exterior power of $V$.  Since we generally have no
preferred choice of such a section, we must interpret our choice
of $g$ as another part of the input data needed to specify $Z$.

We must, of course, also specify the action $S$ for the integrand of $Z$.
We first choose a positive-definite, hermitian metric $h_{\bar \alpha
\alpha}$ on $V$.  Then we consider a $\delta$-trivial action,
\eqn\sone{ S = \delta \left( h_{\bar \alpha \alpha} \,
s^{\bar \alpha} \chi^\alpha \right) \,,}
or expanding,
\eqn\stwo{ S = h_{\bar \alpha \alpha} s^{\bar \alpha} s^\alpha
+ h_{\bar \alpha \alpha} D_{\bar j} s^{\bar \alpha} \,
\theta^{\bar j} \chi^\alpha \,.}
Here $D_{\bar j}$ is the covariant derivative associated to the canonical
connection arising from the metric $h_{\bar \alpha \alpha}$ on $V$.
Recall that the canonical connection \gh\ is the unique connection on $V$
for which $h_{\bar \alpha \alpha}$ is covariantly constant and for
which $D_{\bar j} = \partial_{\bar j}$ when acting on a holomorphic
frame of $V$.

One easy consequence of the fact that $S$ is $\delta$-trivial is that
$S$ is obviously supersymmetric, $\delta S = 0$.  A deeper
consequence of the fact that $S$ is $\delta$-trivial is that the integral
$Z$ is formally independent of the real parameter $t$ and the metric
$h_{\bar \alpha \alpha}$ on $V$ which we introduced.  For instance,
the invariance of $Z$ under changes in $t$ is derived by first
observing that
\eqn\dt{{{d Z} \over {d t}} = - \int_M g \, d \mu \, S \exp{(-t \,
S)} = - \langle S \rangle \,.}
However, if $\CO$ is any function of the variables $z^i$, $z^{\bar
i}$, $\chi^\alpha$, and $\theta^{\bar i}$, then
\eqn\decouple{ \langle \delta \CO \rangle =
\int_M g \, d \mu \, \delta \CO \, \exp{(-t \, S)} = 0\,,}
which in the language of topological field theory is the decoupling of
BRST-trivial observables \refs{\topfield, \cmr}.  Since the action $S$
is of the form $\delta \CO$, we deduce immediately that $d Z / d t = 0$.  The
invariance of $Z$ under deformations of the metric $h_{\bar \alpha
\alpha}$ follows by the same argument.

Finally, we observe that $S$ is invariant under a ghost number
symmetry, under which the anti-commuting variables $\chi^\alpha$ and
$\theta^{\bar i}$ carry charges $-1$ and $+1$ respectively, and
$\delta$ itself carries charge $+1$.  Since the measure $d \mu$ thus
carries ghost number
\eqn\ghostnum{ \dim M - \rk V = n - r\,,}
$Z$ vanishes identically unless $n = r$.  So, if we wish to use $Z$ to
prove a residue theorem, we must assume that $\dim M = \rk V$.

\subsec{A Residue Theorem}

As is familiar from the study of other topological models, we can
prove an interesting theorem by using the fact that $Z$ is
independent of $t$ and then evaluating $Z$ for $t \rightarrow
\infty$ and $t = 0$.  Sometimes, a formal statement such as ``$Z$
is independent of $t$'' could fail to hold if the convergence of $Z$ were
sufficiently poor.  See \silver\ for a nice demonstration of such a
failure in the context of the linear sigma model.  However, because
here $Z$ is an integral over a compact manifold $M$, the convergence
of $Z$ is assured, even when $t=0$, and there are no difficulties with
the formal statements above.

Evaluating $Z$ when $t=0$ is easy.  Then
\eqn\tzero{ Z = \int_M g \, d \mu \; 1 \,= 0\,,}
since neither $\chi^\alpha$ nor $\theta^{\bar i}$ appear in the
integrand above.

Evaluating $Z$ for $t \rightarrow \infty$, we see from the action $S$
in \stwo\ that only points in a neighborhood of the vanishing locus $L$
of the section $s$ contribute to $Z$.  In general, $L$ will consist of
several disconnected components $C$, and $Z$ must have an expression
\eqn\tinf{ Z = \sum_{C \subset L} \, Z(C) \,,}
where $Z(C)$ denotes the local contribution to $Z$ from the component
$C$.  So \tzero\ and \tinf\ imply as a very general vanishing theorem
that
\eqn\vanishing{ \sum_{C \subset L} \, Z(C) = 0 \,.}

The power of this approach is that the vanishing theorem \vanishing\
does not rely on any specific behavior of the section $s$ of $V$.  In
the simplest case, $s$ has simple zeroes on a set of isolated points
of $M$.  But we can equally well consider the case that $s$ has
degenerate zeroes at some points, or even that $s$ vanishes over
some components of positive dimension.  In order to translate
\vanishing\ into a more explicit formula, along the lines of the
one-dimensional residue theorem \resthm, we must simply evaluate the
expression $Z(C)$ for each case.

\bigskip\noindent{\it Multi-dimensional residues}\smallskip\nobreak

To make contact with the one-dimensional residue theorem \resthm, we
will consider at first only the easiest case that $s$ vanishes in a
non-degenerate fasion on a set of isolated points $P$ of $M$.

Recall that the requirement that $s$ vanish non-degenerately at a
point $P$ is simply the condition that the Jacobian $\det{(ds)}$
be non-vanishing at $P$,
\eqn\jac{
\det{(ds)}(P) = \det{\Big( {{\partial(s^1,\cdots,s^n)} \over
{\partial(z^1,\cdots,z^n)}} \Big)}(P) \neq 0.}
In this case, the contribution $Z(P)$ from $P$ can be evaluated
exactly using the Gaussian approximation to $Z$ near this point,
and we easily see that\foot{In the following, we suppress
overall factors of $\pi$ that arise from the Gaussian integration.}
\eqn\zp{ Z(P) = {{g(P)} \over {\det{(ds)}(P)}} \,.}
Thus, the vanishing result \vanishing\ becomes
\eqn\resnthm{ \sum_{P \in L} \, {{g(P)} \over {\det{(ds)}(P)}} = 0\,.}
This expression represents a natural generalization of the
one-dimensional residue theorem \resthm.

To sharpen the correspondence between the formula \resnthm\ and a
multi-dimensional residue theorem, we consider the particular case
that the bundle $V$ is a direct sum of $n$ line bundles,
\eqn\V{ V = \CO(D_1) \oplus \cdots \oplus \CO(D_n) \,,}
which are associated to $n$ irreducible, effective divisors
$D_1,\ldots,D_n$ intersecting transversely at isolated points $P$ in
$M$.

To describe the appropriate section $s$ of $V$ for this case, we note
that each divisor $D_i$ is determined as the vanishing locus
